2021,DF,BRB Cartão ,ATIVA,FINANCEIRO,SOCIEDADE DE ECONOMIA MISTA,Não Dependente,549606408.25,130346266.18,SIM,SIM,NÃO," R$ 465,664.40 ",Sim,197,63844293.48,34178932.77,83658244.81,0.00,0.00,0.00,0.00,,,,Distrito Federal,Centro-oeste,FALSE,FALSE,83658244.81
2020,DF,BRB Cartão ,ATIVA,FINANCEIRO,SOCIEDADE DE ECONOMIA MISTA,Não Dependente,535543.00,100377.00,SIM,SIM,SIM," R$ 24,996.85 ",Sim,180,,31512.00,0.00,0.00,,0.00,,,,,Distrito Federal,Centro-oeste,TRUE,TRUE,
2023,DF,BRB Cartão ,ATIVA,FINANCEIRO,SOCIEDADE DE ECONOMIA MISTA,Não Dependente,1125545334.85,171511809.31,SIM,SIM,NÃO," R$ 581,679.72 ",Sim,272,119770649.70,48489885.10,250656979.60,0.00,0.00,0.00,0.00,353275049.81,https://www.brbcard.com.br,não,Distrito Federal,Centro-oeste,FALSE,FALSE,250656979.62
2021,DF,BRB Crédito Financiamento e Investimento,ATIVA,FINANCEIRO,SOCIEDADE DE ECONOMIA MISTA,Não Dependente,279615136.23,84020098.99,SIM,SIM,SIM," R$ 496,083.70 ",Sim,54,0.00,31719169.01,0.00,0.00,0.00,0.00,0.00,,,,Distrito Federal,Centro-oeste,TRUE,FALSE,0.00
2020,DF,BRB Crédito Financiamento e Investimento,ATIVA,FINANCEIRO,SOCIEDADE DE ECONOMIA MISTA,Não Dependente,215550.00,69817.00,SIM,SIM,SIM," R$ 29,333.56 ",Sim,46,,1613.00,0.00,0.00,,61705.00,,,,,Distrito Federal,Centro-oeste,TRUE,FALSE,-61705.00
2023,DF,BRB Crédito Financiamento e Investimento,ATIVA,FINANCEIRO,SOCIEDADE DE ECONOMIA MISTA,Não Dependente,267010496.97,-4009446.02,SIM,SIM,SIM," R$ 568,950.02 ",Sim,3,0.00,2674949.51,0.00,0.00,0.00,0.00,0.00,0.00,,não,Distrito Federal,Centro-oeste,TRUE,FALSE,0.00
2022,DF,BRB Crédito Financiamento e Investimento,ATIVA,FINANCEIRO,SOCIEDADE DE ECONOMIA MISTA,Não Dependente,323205109.23,57166769.21,SIM,SIM,SIM," R$ 591,961.35 ",Sim,3,0.00,2319126.15,0.00,0.00,0.00,0.00,0.00,150000000.00,,NÃO,Distrito Federal,Centro-oeste,TRUE,FALSE,0.00
2022,DF,BRB DTVM - Distribuidora de Títulos e Valores Mobiliários,ATIVA,FINANCEIRO,SOCIEDADE DE ECONOMIA MISTA,Não Dependente,50789316.89,3248886.64,SIM,SIM,SIM," R$ 552,136.04 ",Sim,5,0.00,3262496.71,0.00,0.00,0.00,0.00,0.00,40000000.00,,NÃO,Distrito Federal,Centro-oeste,TRUE,FALSE,0.00
2021,DF,BRB DTVM - Distribuidora de Títulos e Valores Mobiliários,ATIVA,FINANCEIRO,SOCIEDADE DE ECONOMIA MISTA,Não Dependente,48280892.00,-143216.00,SIM,SIM,SIM," R$ 471,709.20 ",Sim,29,0.00,1406933.00,0.00,0.00,0.00,0.00,0.00,,,,Distrito Federal,Centro-oeste,TRUE,FALSE,0.00
2020,DF,BRB DTVM - Distribuidora de Títulos e Valores Mobiliários,ATIVA,FINANCEIRO,SOCIEDADE DE ECONOMIA MISTA,Não Dependente,48426.00,2178.00,SIM,SIM,SIM," R$ 29,333.56 ",Sim,32,,1532.00,0.00,0.00,,0.00,,,,,Distrito Federal,Centro-oeste,TRUE,TRUE,
2023,CE,Agência de Desenvolvimento do Estado do Ceará SA,ATIVA,DESENVOLVIMENTO REGIONAL,SOCIEDADE DE ECONOMIA MISTA,Não Dependente,185896801.00,28690762.00,SIM,SIM,NÃO," R$ 259,982.00 ",Não,111,6534636.00,16995028.00,0.00,0.00,0.00,0.00,0.00,151568606.00,,não,Ceará,Nordeste,FALSE,FALSE,0.00
2023,CE,Companhia de Água e Esgoto do Ceará,ATIVA,SANEAMENTO,SOCIEDADE DE ECONOMIA MISTA,Não Dependente,2787894535.34,198000330.73,SIM,SIM,SIM," R$ 738,321.92 ",Sim,6265,919343915.60,660112365.30,19854320.23,0.00,0.00,0.00,0.00,2251558211.24,,não,Ceará,Nordeste,TRUE,FALSE,19854320.23
2023,CE,Companhia de Participação de Ativos do Ceará,ATIVA,GESTÃO DE ATIVOS,SOCIEDADE DE ECONOMIA MISTA,Não Dependente,2862559.00,-1964173.00,SIM,SIM,NÃO," R$ 159,480.99 ",Não,7,9765.00,2185413.00,0.00,0.00,0.00,0.00,0.00,2000000.00,https://cppub.cepart.com.br/upload/docInst/Carta_Anual_2021_cearapar.pdf,não,Ceará,Nordeste,FALSE,FALSE,0.00
2023,CE,Centrais de Abastecimento do Ceará SA,ATIVA,ABASTECIMENTO DE ALIMENTOS E OUTROS INSUMOS,SOCIEDADE DE ECONOMIA MISTA,Não Dependente,4031053.56,-1362975.44,SIM,SIM,NÃO," R$ 156,241.96 ",Não,263,0.00,19100305.90,0.00,0.00,1300000.00,0.00,0.00,818302.00,,não,Ceará,Nordeste,FALSE,FALSE,0.00
2023,CE,Companhia de Gás do Ceará,ATIVA,GÁS E DERIVADOS,SOCIEDADE DE ECONOMIA MISTA,Não Dependente,251752697.30,62916540.46,SIM,SIM,SIM," R$ 264,512.46 ",Sim,158,26030324.55,15004266.59,67766083.37,0.00,0.00,0.00,0.00,176876675.30,https://www.cegas.com.br/,não,Ceará,Nordeste,TRUE,FALSE,67766083.37
2023,CE,Companhia de Gestão dos Recursos Hídricos,ATIVA,SANEAMENTO,SOCIEDADE DE ECONOMIA MISTA,Não Dependente,234537833.24,-10170841.94,SIM,SIM,SIM," R$ 464,673.92 ",Sim,907,28974435.00,91337410.00,2323344.04,0.00,0.00,0.00,0.00,149561737.00,https://portal.cogerh.com.br/wp-content/uploads/2023/02/carta-anual-de-politicas-publicas-e-governanca-corporativa-2022.pdf,não,Ceará,Nordeste,TRUE,FALSE,2323344.04
2023,CE,Companhia de Habitação do Ceará,EM LIQUIDAÇÃO,HABITAÇÃO E URBANIZAÇÃO,SOCIEDADE DE ECONOMIA MISTA,Dependente,-298638432.00,-14538981.39,NÃO,SIM,NÃO," R$ 109,994.92 ",Não,41,6297.55,3848444.30,0.00,3394757.81,3077981.64,0.00,0.00,29404405.00,,não,Ceará,Nordeste,FALSE,FALSE,-3394757.81
2023,CE,Companhia de Desenvolvimento do Complexo Industrial e Portuário do Pecém  CIPP SA,ATIVA,PORTOS E HIDROVIAS,SOCIEDADE DE ECONOMIA MISTA,Não Dependente,1182527697.12,89995573.98,SIM,SIM,SIM," R$ 597,679.80 ",Sim,352,65188774.52,60987656.50,32518427.38,0.00,0.00,0.00,0.00,1069658066.19,https://www.complexodopecem.com.br/wp-content/uploads/2022/06/Carta-Anual-2021-1.pdf,não,Ceará,Nordeste,TRUE,FALSE,32518427.38
2023,CE,Empresa de Assistência Técnica e Extensão Rural do Ceará,ATIVA,PESQUISA E ASSISTÊNCIA TÉCNICA AGROPECUÁRIA,EMPRESA PÚBLICA,Dependente,-103801231.48,-2142655.69,SIM,SIM,NÃO," R$ 473,306.86 ",Não,803,2427523.36,108735462.60,0.00,118328110.50,107610744.30,0.00,0.00,2511583.84,,não,Ceará,Nordeste,FALSE,FALSE,-118328110.46
2023,CE,Empresa de Tecnologia da Informação do Ceará,ATIVA,INFORMÁTICA E TECNOLOGIA DA INFORMAÇÃO,EMPRESA PÚBLICA,Dependente,12818799.71,701620.51,SIM,SIM,NÃO," R$ 487,277.96 ",Não,215,350763.00,51091393.68,0.00,71723922.01,45695389.37,0.00,0.00,50000.00,https://www.etice.ce.gov.br/cartas-anuais-de-politicas-publicas-e-governanca-corporativa/,não,Ceará,Nordeste,FALSE,FALSE,-71723922.01
2023,CE,Companhia Cearense de Transportes Metropolitanos,ATIVA,TRANSPORTE,SOCIEDADE DE ECONOMIA MISTA,Dependente,1022700928.90,-28984296.16,SIM,SIM,SIM," R$ 285,108.38 ",Não,391,22384833.34,96725535.92,0.00,196009565.70,0.00,8359764.00,163829798.65,2487453000.00,https://www.metrofor.ce.gov.br/wp-content/uploads/sites/32/2022/03/Carta_Poli%CC%81ticas_Pu%CC%81blicasGovernanc%CC%A7a-2021.pdf,sim,Ceará,Nordeste,TRUE,FALSE,-204369329.73
2023,BA,Companhia de Gás da Bahia  Bahiagás,ATIVA,GÁS E DERIVADOS,SOCIEDADE DE ECONOMIA MISTA,Não Dependente,786173513.00,211095374.79,SIM,SIM,NÃO," R$ 495,167.64 ",Sim,319,117013693.80,86422912.38,36314325.00,0.00,0.00,0.00,0.00,295589280.00,https://www.bahiagas.com.br/sobre-a-bahiagas/cartas-anuais,não,Bahia,Nordeste,FALSE,FALSE,36314325.00
2023,BA,EMPRESA BAIANA DE ATIVOS SA,ATIVA,GESTÃO DE ATIVOS,SOCIEDADE DE ECONOMIA MISTA,Não Dependente,66657839.35,-2938133.01,SIM,SIM,NÃO," R$ 371,598.47 ",Não,13,0.00,3248442.97,0.00,0.00,0.00,0.00,25205673.40,80735673.40,http://www.bahiainveste.ba.gov.br/wp-content/uploads/2022/08/CARTA-,não,Bahia,Nordeste,FALSE,FALSE,0.00
2023,BA,BAHIA PESCA SA,ATIVA,PESQUISA E ASSISTÊNCIA TÉCNICA AGROPECUÁRIA,SOCIEDADE DE ECONOMIA MISTA,Dependente,-8451737.00,-66978.00,SIM,SIM,NÃO," R$ 270,400.00 ",Não,190,1231237.31,12052438.07,0.00,4506880.00,3954231.00,0.00,0.00,4824688.64,http://www.bahiapesca.ba.gov.br/arquivos/File/CARTAANUAL2021.pdf,não,Bahia,Nordeste,FALSE,FALSE,-4506880.00
2023,BA,Companhia Baiana de Pesquisa Mineral,ATIVA,MINERAÇÃO,SOCIEDADE DE ECONOMIA MISTA,Dependente,91866681.05,12635523.37,SIM,SIM,NÃO," R$ 281,024.65 ",Não,171,1643232.26,29414882.38,0.00,7080708.68,18890129.03,0.00,0.00,100000000.00,http://www.cbpm.ba.gov.br/transparencia/carta-anual-de-politicas-publicas-e-governanca-corporativa/,não,Bahia,Nordeste,FALSE,FALSE,-7080708.68
2023,BA,COMPANHIA DE ENGENHARIA HIDRICA E DE SANEAMENTO DA BAHIA,ATIVA,SANEAMENTO,SOCIEDADE DE ECONOMIA MISTA,Dependente,-8302802.49,-20344330.02,SIM,SIM,SIM," R$ 319,591.27 ",Não,803,65846081.43,58528876.39,0.00,110774769.20,95388106.44,0.00,0.00,131206906.00,,não,Bahia,Nordeste,TRUE,FALSE,-110774769.16
2023,BA,COMPANHIA DE DESENVOLVIMENTO URBANO DO ESTADO DA BAHIA,ATIVA,HABITAÇÃO E URBANIZAÇÃO,EMPRESA PÚBLICA,Dependente,200077706.29,-23242142.36,SIM,SIM,NÃO," R$ 236,552.74 ",Não,368,0.00,26994717.82,0.00,852393362.40,489098926.90,0.00,0.00,16803753.00,https://www.conder.ba.gov.br/sites/default/files/documentos/2023-04/Carta%20Anual%20de%20Governan%C3%A7a%20Corporativa%202023%20-%20exercicio%202022.pdf,não,Bahia,Nordeste,FALSE,FALSE,-852393362.39
2023,BA,EMPRESA BAIANA DE AGUAS E SANEAMENTO DA BAHIA,ATIVA,SANEAMENTO,SOCIEDADE DE ECONOMIA MISTA,Não Dependente,7044425700.11,456785890.48,SIM,SIM,SIM," R$ 780,081.11 ",Sim,4114,1178725201.00,904414364.10,0.00,0.00,0.00,8951863.78,0.00,4957122520.00,https://www.embasa.ba.gov.br/index.php/institucional/a-embasa/governanca/carta-anual-de-governanca-corporativa,não,Bahia,Nordeste,TRUE,FALSE,-8951863.78
2023,BA,Agência de Fomento do Estado da Bahia SA,ATIVA,FINANCEIRO,SOCIEDADE DE ECONOMIA MISTA,Não Dependente,738521418.20,77051897.13,SIM,SIM,SIM," R$ 400,187.23 ",Sim,252,0.00,57814418.40,9622959.34,0.00,0.00,0.00,0.00,588225390.44,https://www.desenbahia.ba.gov.br/wp-content/uploads/2023/04/carta-anual-pp-e-gc-2022-revfinal.pdf,não,Bahia,Nordeste,TRUE,FALSE,9622959.34
2023,BA,COMPANHIA DE DESENVOLVIMENTO E AÇÃO REGIONAL,ATIVA,DESENVOLVIMENTO REGIONAL,EMPRESA PÚBLICA,Dependente,-38042100.28,789690.08,SIM,SIM,NÃO," R$ 285,390.84 ",Não,523,650879240.60,65944823.65,0.00,44309929.01,41034217.44,0.00,0.00,13542532.35,-,não,Bahia,Nordeste,FALSE,FALSE,-44309929.01
2023,BA,COMPANHIA DE TRANSPORTE DO ESTADO DA BAHIA,ATIVA,TRANSPORTE,EMPRESA PÚBLICA,Dependente,56843121.94,5551914.13,SIM,SIM,NÃO," R$ 259,731.63 ",Não,126,70741159.81,17367783.00,0.00,652734763.60,61493086.00,0.00,0.00,139654487.18,-,não,Bahia,Nordeste,FALSE,FALSE,-652734763.63
2023,BA,Empresa Gráfica da Bahia,ATIVA,COMUNICAÇÃO,EMPRESA PÚBLICA,Não Dependente,62593670.00,1023382.00,SIM,SIM,SIM," R$ 389,604.76 ",Não,410,0.00,27488813.90,0.00,0.00,0.00,0.00,0.00,0.00,-,não,Bahia,Nordeste,TRUE,FALSE,0.00
2023,BA,COMPANHIA DE PROCESSAMENTO DE DADOS DO ESTADO DA BAHIA,ATIVA,INFORMÁTICA E TECNOLOGIA DA INFORMAÇÃO,SOCIEDADE DE ECONOMIA MISTA,Não Dependente,83641243.44,21666332.00,SIM,SIM,SIM," R$ 255,523.38 ",Não,628,21227610.00,80899990.64,0.00,0.00,0.00,12281273.00,0.00,111887147.00,https://www.prodeb.ba.gov.br/transparencia/governanca-corporativa/carta-anual-de-politicas-publicas-e-governanca-corporativa,não,Bahia,Nordeste,TRUE,FALSE,-12281273.00
2023,BA,Habitação e Urbanização da Bahia SA,EM LIQUIDAÇÃO,HABITAÇÃO E URBANIZAÇÃO,SOCIEDADE DE ECONOMIA MISTA,Não Dependente,-49892259.66,-9433649.04,SIM,SIM,NÃO," R$ 167,780.41 ",Não,57,0.00,6760079.92,0.00,0.00,0.00,6000000.00,6000000.00,341078042.00,-,não,Bahia,Nordeste,FALSE,FALSE,-6000000.00
2023,AM,Empresa Estadual de Turismo  Amazonastur,ATIVA,TURISMO,EMPRESA PÚBLICA,Dependente,5536741.44,-231298.80,SIM,SIM,SIM," R$ 324,731.67 ",Não,146,24356.00,13022732.55,0.00,89476491.55,22614181.26,0.00,0.00,27123375.38,www.amazonastur.am.gov.br,não,Amazonas,Norte,TRUE,FALSE,-89476491.55
2023,AM,Agência de Fomento do Estado do Amazonas SA  AFEAM,ATIVA,FINANCEIRO,EMPRESA PÚBLICA,Não Dependente,108563922.80,5765266.52,SIM,SIM,SIM," R$ 415,123.08 ",Sim,258,120466.00,40356198.53,0.00,0.00,0.00,0.00,0.00,98047947.00,www.afeam.am.gov.br,não,Amazonas,Norte,TRUE,FALSE,0.00
2023,AM,Companhia de Desenvolvimento do Estado do Amazonas  CIAMA,ATIVA,DESENVOLVIMENTO REGIONAL,SOCIEDADE DE ECONOMIA MISTA,Não Dependente,57240109.80,-971908.44,SIM,SIM,NÃO," R$ 478,160.00 ",Não,215,867578.04,27659528.74,0.00,29927040.76,25032735.46,0.00,1000000.00,326979280.28,www.ciama.am.gov.br,sim,Amazonas,Norte,FALSE,FALSE,-29927040.76
2023,AM,Companhia Amazonense de Desenvolvimento e Mobilização de Ativos  CADA,ATIVA,GESTÃO DE ATIVOS,EMPRESA PÚBLICA,Não Dependente,1354428.00,-4537338.00,SIM,SIM,SIM," R$ 371,000.00 ",Não,26,4733.00,4391179.00,0.00,0.00,0.00,0.00,0.00,9000000.00,www.cada.am.gov.br,não,Amazonas,Norte,TRUE,FALSE,0.00
2023,AM,Companhia de Gás do Amazonas,ATIVA,GÁS E DERIVADOS,SOCIEDADE DE ECONOMIA MISTA,Não Dependente,312938713.03,114331695.12,SIM,SIM,NÃO," R$ 480,000.00 ",Sim,223,46430666.06,34059408.26,9406347.20,0.00,0.00,0.00,0.00,39266906.63,www.cigas-am.com.br,não,Amazonas,Norte,FALSE,FALSE,9406347.20
2023,AM,PRODAM Processamento de Dados Amazonas SA,ATIVA,INFORMÁTICA E TECNOLOGIA DA INFORMAÇÃO,SOCIEDADE DE ECONOMIA MISTA,Não Dependente,51578873.00,6369352.00,SIM,SIM,SIM," R$ 644,489.80 ",Sim,340,2226619.00,79047981.79,0.00,0.00,0.00,0.00,0.00,45144417.00,www.prodam.am.gov.br,não,Amazonas,Norte,TRUE,FALSE,0.00
2023,AM,Companhia de Saneamento do Amazonas  Cosama,ATIVA,SANEAMENTO,SOCIEDADE DE ECONOMIA MISTA,Dependente,-3479839.25,-21294146.58,SIM,SIM,NÃO," R$ 396,321.16 ",Não,433,13277476.96,40739370.25,0.00,44240949.77,40056685.04,14500000.00,8513912.07,532581469.06,www.cosama.am.gov.br,não,Amazonas,Norte,FALSE,FALSE,-58740949.77
2023,AM,Agência de Desenvolvimento Sustentável do Amazonas  ADS,ATIVA,DESENVOLVIMENTO REGIONAL,EMPRESA PÚBLICA,Dependente,5582947.33,-15054.45,SIM,SIM,NÃO," R$ 156,000.00 ",Não,62,140729.48,5049126.44,0.00,134194729.40,109531481.10,0.00,0.00,10000000.00,não,não,Amazonas,Norte,FALSE,FALSE,-134194729.39
2023,AP,COMPANHIA DE ÁGUA E ESGOTO DO AMAPÁ  CAESA,ATIVA,SANEAMENTO,SOCIEDADE DE ECONOMIA MISTA,Dependente,290798320.79,56947033.11,SIM,SIM,NÃO," R$ 242,526.00 ",Não,414,18635505.34,42309073.56,0.00,0.00,0.00,0.00,0.00,458045958.50,caesa.portal.ap.gov.br,não,Amapá,Norte,FALSE,FALSE,0.00
2023,AP,COMPANHIA DE GÁS DO AMAPÁ  GASAP,ATIVA,GÁS E DERIVADOS,SOCIEDADE DE ECONOMIA MISTA,Não Dependente,584340.29,-185321.00,SIM,SIM,NÃO," R$ 29,282.00 ",Não,2,0.00,72334.74,0.00,0.00,0.00,0.00,0.00,0.00,0,não,Amapá,Norte,FALSE,FALSE,0.00
2023,AP,Agência de Fomento Popular AFAP,ATIVA,FINANCEIRO,EMPRESA PÚBLICA,Não Dependente,15237488.18,-2253804.96,SIM,SIM,NÃO," R$ 145,128.04 ",Não,93,0.00,7465479.93,0.00,0.00,0.00,15600000.00,1000000.00,0.00,0,não,Amapá,Norte,FALSE,FALSE,-15600000.00
2023,AL,GÁS DE ALAGOAS SA,ATIVA,GÁS E DERIVADOS,SOCIEDADE DE ECONOMIA MISTA,Não Dependente,126374886.49,50442967.64,SIM,SIM,SIM," R$ 289,043.47 ",Sim,137,14242860.33,24773424.91,5863583.59,0.00,0.00,0.00,0.00,19455893.15,https://governanca.algas.com.br/carta-anual-de-politicas-publicas-e-governanca-corporativa,não,Alagoas,Nordeste,TRUE,FALSE,5863583.59
2023,AL,Alagoas Ativos SA,ATIVA,GESTÃO DE ATIVOS,EMPRESA PÚBLICA,Não Dependente,432324.00,-2076695.50,SIM,SIM,NÃO," R$ 25,139.14 ",Não,16,0.00,2419361.84,0.00,0.00,0.00,0.00,0.00,0.00,,não,Alagoas,Nordeste,FALSE,FALSE,0.00
2023,AL,COMPANHIA DE EDIÇÃO IMPRESSÃO E PUBLICAÇÃO DE ALAGOAS,ATIVA,COMUNICAÇÃO,SOCIEDADE DE ECONOMIA MISTA,Não Dependente,6191400.44,106476.90,SIM,SIM,NÃO," R$ 188,132.40 ",Não,121,2226278.61,6840428.68,0.00,0.00,0.00,0.00,0.00,10083000.00,https://www.imprensaoficial.al.gov.br/carta-anual-de-politicas-publicas-e-governanca-corporativa,não,Alagoas,Nordeste,FALSE,FALSE,0.00
2023,AL,AGÊNCIA DE FOMENTO DE ALAGOAS,ATIVA,FINANCEIRO,SOCIEDADE DE ECONOMIA MISTA,Dependente,60326674.29,-3676303.94,SIM,SIM,NÃO," R$ 3,568,856.50 ",Não,60,0.00,5353226.68,0.00,1022384.77,1011455.34,7.50,7.93,80413900.00,https://www.desenvolve-al.com.br/institucional/relatorios-da-administracao/,não,Alagoas,Nordeste,FALSE,FALSE,-1022392.27
2023,AL,BANCO DO ESTADO DE ALAGOAS SA  EM LIQUIDAÇÃO,EM LIQUIDAÇÃO,FINANCEIRO,SOCIEDADE DE ECONOMIA MISTA,Dependente,144678633.05,-2808599.92,NÃO,SIM,NÃO," R$ 48,319.53 ",Não,2,1299.00,506853.77,0.00,0.00,0.00,0.00,0.00,0.00,,não,Alagoas,Nordeste,FALSE,FALSE,0.00
2023,AL,COMPANHIA DE SANEAMENTO DE ALAGOAS,ATIVA,SANEAMENTO,SOCIEDADE DE ECONOMIA MISTA,Não Dependente,-177972949.85,-70005175.26,SIM,SIM,SIM," R$ 417,222.81 ",Não,855,17986901.91,104868956.90,0.00,0.00,0.00,77500000.00,0.00,424881666.34,,não,Alagoas,Nordeste,TRUE,FALSE,-77500000.00
2023,AC,Agencia de Negócios do Estado do Acre  ANAC,ATIVA,OUTROS,SOCIEDADE DE ECONOMIA MISTA,Dependente,44718292.95,-7400782.09,SIM,SIM,NÃO," R$ 2,558,691.71 ",Não,40,37626.00,2797443.13,0.00,0.00,0.00,3765720.72,2247519.62,150642058.77,,não,Acre,Norte,FALSE,FALSE,-3765720.72
2023,AC,Administradora da Zona de Processamento de Exportação do Acre  AZPEAC,ATIVA,DESENVOLVIMENTO REGIONAL,SOCIEDADE DE ECONOMIA MISTA,Dependente,0.00,0.00,SIM,SIM,NÃO, R$ -   ,Não,4,0.00,0.00,0.00,0.00,0.00,0.00,0.00,55000.00,,não,Acre,Norte,FALSE,FALSE,0.00
2023,AC,Banco do Estado do Acre  BANACRE,EM LIQUIDAÇÃO,FINANCEIRO,SOCIEDADE DE ECONOMIA MISTA,Dependente,-194244590.28,-2491663.57,SIM,SIM,NÃO," R$ 102,362.58 ",Não,14,0.00,1368733.31,0.00,1816422.32,1600685.13,0.00,0.00,24365820.86,,não,Acre,Norte,FALSE,FALSE,-1816422.32
2023,AC,Companhia de Armazéns e Entrepostos do Acre  CAGEACRE,ATIVA,ABASTECIMENTO DE ALIMENTOS E OUTROS INSUMOS,EMPRESA PÚBLICA,Dependente,8219090.99,678045.71,SIM,SIM,NÃO," R$ 306,437.79 ",Não,165,7550771.37,9427604.50,0.00,19543507.28,9082999.24,0.00,27000.00,8219090.99,,não,Acre,Norte,FALSE,FALSE,-19543507.28
2023,AC,Companhia Industrial de Laticínios do Acre  CILA,ATIVA,ABASTECIMENTO DE ALIMENTOS E OUTROS INSUMOS,EMPRESA PÚBLICA,Dependente,-77975728.39,-13339485.71,SIM,SIM,NÃO," R$ 1,748,667.71 ",Não,24,1686.87,1759369.71,0.00,2231887.12,1935664.94,0.00,0.00,416.44,,não,Acre,Norte,FALSE,FALSE,-2231887.12
2023,AC,Companhia de Desenvolvimento Industrial do Acre  CODISACRE,ATIVA,DESENVOLVIMENTO REGIONAL,EMPRESA PÚBLICA,Dependente,7157066.52,913107.21,SIM,SIM,NÃO," R$ 2,046,687.87 ",Não,48,244185.81,2379595.30,0.00,4287984.01,3692043.52,0.00,0.00,3797524.50,,não,Acre,Norte,FALSE,FALSE,-4287984.01
2023,AC,Companhia de Colonização do Acre  COLONACRE,EM LIQUIDAÇÃO,OUTROS,EMPRESA PÚBLICA,Dependente,5830279.59,27522.45,SIM,SIM,NÃO," R$ 997,453.60 ",Não,17,99008.27,1090822.97,0.00,70188.82,876623.50,0.00,0.00,3598917.22,,não,Acre,Norte,FALSE,FALSE,-70188.82
2023,AC,Companhia de Saneamento do Acre  SANACRE,EM LIQUIDAÇÃO,SANEAMENTO,SOCIEDADE DE ECONOMIA MISTA,Dependente,0.00,0.00,SIM,SIM,NÃO," R$ 156,437.33 ",Não,192,0.00,20217286.59,0.00,3135294.83,10140978.06,0.00,0.00,0.00,,não,Acre,Norte,FALSE,FALSE,-3135294.83
2023,AC,Companhia de Habitação do Acre  COHABACRE,ATIVA,HABITAÇÃO E URBANIZAÇÃO,SOCIEDADE DE ECONOMIA MISTA,Dependente,79307669.34,3953141.14,SIM,SIM,NÃO," R$ 250,159.51 ",Não,61,4493.28,478251.87,0.00,6654102.66,8878252.82,0.00,0.00,62840607.31,,não,Acre,Norte,FALSE,FALSE,-6654102.66
2023,AC,Companhia Agência de Desenvolvimento e Serviços Ambientais do Estado do Acre  CDSA,ATIVA,DESENVOLVIMENTO REGIONAL,SOCIEDADE DE ECONOMIA MISTA,Dependente,3000080728.39,-24406.99,SIM,SIM,NÃO," R$ 151,060.03 ",Não,8,0.00,822743.33,0.00,576860.27,1569900.68,1650000.00,0.00,3000062000.00,,não,Acre,Norte,FALSE,FALSE,-2226860.27
2023,AC,Empresa de Processamento de Dados do Acre SA  ACREDATA,ATIVA,INFORMÁTICA E TECNOLOGIA DA INFORMAÇÃO,SOCIEDADE DE ECONOMIA MISTA,Dependente,-81789699.71,-8666492.63,SIM,SIM,NÃO," R$ 115,144.98 ",Não,75,0.00,8421164.87,0.00,10032591.15,9085516.43,0.00,0.00,4396687.58,,não,Acre,Norte,FALSE,FALSE,-10032591.15
2023,AC,Empresa de Assistência Técnica e Extensão Rural do Acre  EMATER,ATIVA,PESQUISA E ASSISTÊNCIA TÉCNICA AGROPECUÁRIA,EMPRESA PÚBLICA,Dependente,-536682.04,-202172.41,SIM,SIM,NÃO," R$ 154,865.48 ",Não,163,653737.00,19087104.90,0.00,21980155.84,19730427.58,0.00,0.00,0.00,,não,Acre,Norte,FALSE,FALSE,-21980155.84
2023,DF,BRB DTVM - Distribuidora de Títulos e Valores Mobiliários,ATIVA,FINANCEIRO,SOCIEDADE DE ECONOMIA MISTA,Não Dependente,50789316.89,8116466.72,SIM,SIM,SIM," R$ 603,070.89 ",Sim,5,0.00,2719949.92,0.00,0.00,0.00,0.00,0.00,40000000.00,,não,Distrito Federal,Centro-oeste,TRUE,FALSE,0.00
2022,AC,Agencia de Negócios do Estado do Acre,ATIVA,OUTROS,SOCIEDADE DE ECONOMIA MISTA,Dependente,48353354.32,-24479884.96,SIM,SIM,NÃO," R$ 196,128.00 ",Não,18,0.00,2123106.04,0.00,0.00,0.00,2247519.62,1767218.57,146871838.05,,NÃO,Acre,Norte,FALSE,FALSE,-2247519.62
2022,AC,Administradora da Zona de Processamento de Exportação do Acre - AZPE/AC,ATIVA,DESENVOLVIMENTO REGIONAL,SOCIEDADE DE ECONOMIA MISTA,Dependente,0.00,-55746.01,SIM,SIM,NÃO, R$ -   ,Não,0,0.00,0.00,0.00,0.00,0.00,0.00,0.00,55000.00,,NÃO,Acre,Norte,FALSE,FALSE,0.00
2022,AC,Banco do Estado do Acre - BANACRE,EM LIQUIDAÇÃO,FINANCEIRO,SOCIEDADE DE ECONOMIA MISTA,Dependente,-191752566.47,-942857.86,SIM,SIM,NÃO," R$ 95,768.02 ",Não,14,0.00,1146293.69,0.00,1600685.13,1525569.00,0.00,0.00,24365820.86,,NÃO,Acre,Norte,FALSE,FALSE,-1600685.13
2022,AC,Companhia de Armazéns e Entrepostos do Acre - CAGEACRE,ATIVA,ABASTECIMENTO DE ALIMENTOS E OUTROS INSUMOS,EMPRESA PÚBLICA,Dependente,8192906.14,682466.81,SIM,SIM,NÃO," R$ 346,731.32 ",Não,140,133788.20,8082255.82,494565.41,9082999.24,9575806.83,27000.00,27000.00,8955849.76,,NÃO,Acre,Norte,FALSE,FALSE,-8615433.83
2022,AC,Companhia Industrial de Laticínios do Acre - CILA,ATIVA,ABASTECIMENTO DE ALIMENTOS E OUTROS INSUMOS,SOCIEDADE DE ECONOMIA MISTA,Dependente,-64543713.30,12022303.16,SIM,SIM,NÃO," R$ 176,800.00 ",Não,25,0.00,1316291.74,0.00,1935664.94,1593809.51,0.00,0.00,416.44,,NÃO,Acre,Norte,FALSE,FALSE,-1935664.94
2022,AC,Companhia de Desenvolvimento Industrial do Acre - CODISACRE,ATIVA,DESENVOLVIMENTO REGIONAL,EMPRESA PÚBLICA,Dependente,-7255905.61,696130.92,SIM,SIM,NÃO," R$ 176,800.00 ",Não,47,0.00,2914556.76,0.00,3692043.52,3662859.62,0.00,0.00,3797524.50,,NÃO,Acre,Norte,FALSE,FALSE,-3692043.52
2022,AC,Companhia de Colonização do Acre - COLONACRE,EM LIQUIDAÇÃO,OUTROS,EMPRESA PÚBLICA,Dependente,-5856447.48,-178986.58,SIM,SIM,NÃO," R$ 176,800.00 ",Não,15,0.00,983816.25,0.00,876623.50,789372.18,0.00,0.00,3598917.22,,NÃO,Acre,Norte,FALSE,FALSE,-876623.50
2022,AC,Companhia de Saneamento do Acre - SANACRE,ATIVA,SANEAMENTO,SOCIEDADE DE ECONOMIA MISTA,Dependente,-18949354.32,-18949354.32,SIM,SIM,NÃO," R$ 236,043.74 ",Não,191,0.00,20139047.96,0.00,10140978.06,10278585.48,0.00,0.00,123139981.75,,NÃO,Acre,Norte,FALSE,FALSE,-10140978.06
2022,AC,Companhia de Habitação do Acre - COHAB/ACRE,ATIVA,HABITAÇÃO E URBANIZAÇÃO,SOCIEDADE DE ECONOMIA MISTA,Dependente,79307669.34,3953141.14,SIM,SIM,NÃO," R$ 237,911.72 ",Não,61,0.00,5027697.04,0.00,8878252.82,14847812.46,0.00,0.00,62835007.31,,NÃO,Acre,Norte,FALSE,FALSE,-8878252.82
2022,AC,Companhia Agência de Desenvolvimento e Serviços Ambientais do Estado do Acre - CDSA,ATIVA,DESENVOLVIMENTO REGIONAL,SOCIEDADE DE ECONOMIA MISTA,Dependente,103135.32,43135.32,SIM,SIM,NÃO, R$ -   ,Não,0,49200.00,0.00,0.00,1569900.68,13000.02,0.00,0.00,60000.00,,NÃO,Acre,Norte,FALSE,FALSE,-1569900.68
2022,AC,Empresa de Processamento de Dados do Acre S/A - ACREDATA,ATIVA,INFORMÁTICA E TECNOLOGIA DA INFORMAÇÃO,SOCIEDADE DE ECONOMIA MISTA,Dependente,-73130330.50,-7781835.10,SIM,SIM,NÃO," R$ 163,200.00 ",Não,68,0.00,5845587.49,0.00,9085516.43,8719160.17,0.00,0.00,4396687.58,,NÃO,Acre,Norte,FALSE,FALSE,-9085516.43
2022,AC,Empresa de Assistência Técnica e Extensão Rural do Acre - EMATER,ATIVA,PESQUISA E ASSISTÊNCIA TÉCNICA AGROPECUÁRIA,EMPRESA PÚBLICA,Dependente,-2982970.12,651732.77,SIM,SIM,NÃO," R$ 119,855.99 ",Não,176,518700.00,17308822.52,0.00,19730427.58,18524821.75,0.00,0.00,0.01,,NÃO,Acre,Norte,FALSE,FALSE,-19730427.58
2022,AL,AGÊNCIAS DE FOMENTO DE ALAGOAS - DESENVOLVE,ATIVA,FINANCEIRO,SOCIEDADE DE ECONOMIA MISTA,Dependente,63735991.92,-3512967.82,SIM,SIM,NÃO," R$ 295,413.02 ",Não,46,0.00,3866107.20,0.00,1017518.88,955686.12,0.00,0.00,80414000.00,https://www.desenvolve-al.com.br/institucional/relatorios-da-administracao/,NÃO,Alagoas,Nordeste,FALSE,FALSE,-1017518.88
2022,AL,ALAGOAS ATIVOS S/A,ATIVA,GESTÃO DE ATIVOS,EMPRESA PÚBLICA,Não Dependente,10000000.00,-11105313.64,SIM,SIM,NÃO," R$ 22,829.57 ",Não,11,0.00,1816670.22,0.00,0.00,0.00,0.00,0.00,0.00,https://www.alagoasativos.com.br/governanca/politicas/,NÃO,Alagoas,Nordeste,FALSE,FALSE,0.00
2022,AL,COMPANHIA ALAGOANA DE RECURSOS HUMANOS E PATRIMONIAIS - CARHP,EM LIQUIDAÇÃO,HABITAÇÃO E URBANIZAÇÃO,SOCIEDADE DE ECONOMIA MISTA,Dependente,10693072.99,-42707.56,SIM,SIM,NÃO," R$ 180,620.00 ",Não,34,0.00,1766343.23,0.00,0.00,0.00,0.00,0.00,4964380.41,,NÃO,Alagoas,Nordeste,FALSE,FALSE,0.00
2022,AL,COMPANHIA DE EDIÇÃO IMPRESSÃO E PUBLICAÇÃO DE ALAGOAS - CEPAL,ATIVA,COMUNICAÇÃO,SOCIEDADE DE ECONOMIA MISTA,Não Dependente,5750767.54,140824.27,SIM,SIM,NÃO," R$ 98,660.95 ",Não,105,503345.00,5629717.66,0.00,0.00,0.00,0.00,0.00,10083000.00,,NÃO,Alagoas,Nordeste,FALSE,FALSE,0.00
2022,AL,GÁS DE ALAGOAS S/A - ALGÁS,ATIVA,GÁS E DERIVADOS,SOCIEDADE DE ECONOMIA MISTA,Não Dependente,102929597.09,29327009.27,SIM,SIM,SIM," R$ 228,299.92 ",Sim,139,11601179.29,19119770.45,16141718.20,0.00,0.00,0.00,0.00,11382382.93,https://algas.com.br/servicos/,NÃO,Alagoas,Nordeste,TRUE,FALSE,16141718.20
2022,AL,BANCO DO ESTADO DE ALAGOAS S/A - PRODUBAN,EM LIQUIDAÇÃO,FINANCEIRO,SOCIEDADE DE ECONOMIA MISTA,Não Dependente,147487208.47,-4953680.73,NÃO,SIM,NÃO," R$ 42,002.33 ",Não,6,0.00,522020.02,0.00,0.00,0.00,0.00,0.00,499811100.00,,NÃO,Alagoas,Nordeste,FALSE,FALSE,0.00
2022,AL,LABORATORIO INDUSTRIAL FARMACEUTICO DE ALAGOAS S/A - LIFAL,EM LIQUIDAÇÃO,SAÚDE,SOCIEDADE DE ECONOMIA MISTA,Dependente,-86577.26,-355535.80,NÃO,SIM,NÃO," R$ 352,495.13 ",Não,7,0.00,352061.93,0.00,0.00,0.00,0.00,0.00,0.00,,NÃO,Alagoas,Nordeste,FALSE,FALSE,0.00
