2021,RJ,IMPRENSA OFICIAL D ESTADO DO RIO DE JANEIRO,ATIVA,COMUNICAÇÃO,EMPRESA PÚBLICA,Não Dependente,130639581.13,5974417.36,SIM,SIM,NÃO," R$ 179,061.72 ",Não,234,0.00,20078718.99,0.00,0.00,0.00,0.00,0.00,,,,Rio de Janeiro,Sudeste,FALSE,FALSE,0.00
2021,RJ,Empresa de Assistência Técnica e Extensão Rural do Etado do Rio de Janeiro - EMATER-RIO,ATIVA,PESQUISA E ASSISTÊNCIA TÉCNICA AGROPECUÁRIA,EMPRESA PÚBLICA,Dependente,78832.11,-18162.58,SIM,SIM,SIM," R$ 298,413.56 ",Não,588,0.00,79608604.31,0.00,93666210.78,87111831.60,0.00,0.00,,,,Rio de Janeiro,Sudeste,TRUE,FALSE,-93666210.78
2021,RJ,INSTITUTO VITAL BRAZIL S.A,ATIVA,SAÚDE,SOCIEDADE DE ECONOMIA MISTA,Dependente,21972512.05,8545542.56,SIM,SIM,SIM," R$ 74,864,600,000,000,000.00 ",Não,124,288889.02,27001072.61,0.00,48882025.01,48445637.06,0.00,0.00,,,,Rio de Janeiro,Sudeste,TRUE,FALSE,-48882025.01
2021,RJ,"CENTRAIS ELETRICAS FLUMINENSES S/A - CELF ""Em liquidação""",EM LIQUIDAÇÃO,ENERGIA,SOCIEDADE DE ECONOMIA MISTA,Não Dependente,82.93,0.00,NÃO,NÃO,NÃO, R$ -   ,Não,0,0.00,0.00,0.00,610.00,0.00,0.00,0.00,,,,Rio de Janeiro,Sudeste,FALSE,FALSE,-610.00
2021,RJ,Companhia de Turismo do Estado do Rio de Janeiro - TurisRio,ATIVA,TURISMO,EMPRESA PÚBLICA,Dependente,-386049.28,67209.19,SIM,SIM,NÃO," R$ 112,710.53 ",Não,66,0.00,6199234.36,0.00,11481895.99,7764834.80,3710.14,156321.52,,,,Rio de Janeiro,Sudeste,FALSE,FALSE,-11485606.13
2021,RJ,"Distribuidora de Titulos e Valores Mobliarios do Estado do Rio de Janeiro S/A - DIVERJ ""Em Liquidação""",EM LIQUIDAÇÃO,FINANCEIRO,SOCIEDADE DE ECONOMIA MISTA,Não Dependente,682620.09,3717.28,NÃO,NÃO,NÃO, R$ -   ,Não,0,0.00,139971.27,0.00,0.00,0.00,0.00,0.00,,,,Rio de Janeiro,Sudeste,FALSE,FALSE,0.00
2021,RJ,COMPANHIA DESENVOLVIMENTO INDUSTRIAL DO RJ,ATIVA,DESENVOLVIMENTO REGIONAL,SOCIEDADE DE ECONOMIA MISTA,Dependente,45793804.30,1392917.71,SIM,SIM,NÃO," R$ 24,552,700,000,000,000.00 ",Não,76,2550.00,10272426.54,0.00,9543628.70,8165486.45,0.00,0.00,,,,Rio de Janeiro,Sudeste,FALSE,FALSE,-9543628.70
2021,RJ,"BANCO DE DESENVOLVIMENTO DO ESTADO DO RJ S.A - BDRIO ""Em Liquidação""",EM LIQUIDAÇÃO,FINANCEIRO,SOCIEDADE DE ECONOMIA MISTA,Não Dependente,2102686.64,-612538.55,NÃO,NÃO,NÃO," R$ 80,511,800,000,000,000.00 ",Não,2,0.00,132080.17,0.00,0.00,0.00,0.00,0.00,,,,Rio de Janeiro,Sudeste,FALSE,FALSE,0.00
2021,RJ,"Companhia de Transportes Coletivos do Estado do Rio de Janeiro ""Em Liquidação""",EM LIQUIDAÇÃO,TRANSPORTE,SOCIEDADE DE ECONOMIA MISTA,Dependente,-5019400.47,-75045361.26,NÃO,NÃO,NÃO," R$ 100,559.14 ",Não,4,0.00,388924.13,0.00,463245.12,600073.66,0.00,0.00,,,,Rio de Janeiro,Sudeste,FALSE,FALSE,-463245.12
2021,RJ,COMPANHIA DE ARMAZÉNS E SILOS DO ESTADO DO RJ,ATIVA,ABASTECIMENTO DE ALIMENTOS E OUTROS INSUMOS,EMPRESA PÚBLICA,Dependente,862160.78,610671.20,SIM,SIM,NÃO," R$ 12,148,000,000,000,000.00 ",Não,53,0.00,3217269.96,0.00,0.00,0.00,0.00,0.00,,,,Rio de Janeiro,Sudeste,FALSE,FALSE,0.00
2021,RJ,Companhia Estadual de Águas e Esgotos - CEDAE,ATIVA,SANEAMENTO,SOCIEDADE DE ECONOMIA MISTA,Não Dependente,7089254000.00,-2471500.00,SIM,SIM,SIM," R$ 10,975,500,000,000,000.00 ",Sim,5081,82178000.00,1267681000.00,11711800.00,0.00,0.00,0.00,0.00,,,,Rio de Janeiro,Sudeste,TRUE,FALSE,11711800.00
2021,RJ,COMPANHIA ESTADUAL DE HABITACAO DO RJ CEHAB RJ,ATIVA,HABITAÇÃO E URBANIZAÇÃO,SOCIEDADE DE ECONOMIA MISTA,Dependente,94327687.52,-102583.29,SIM,SIM,NÃO," R$ 24,540,100,000,000,000.00 ",Não,356,51629268.07,39855239.41,0.00,109283877.10,87035053.97,0.00,228066288.04,,,,Rio de Janeiro,Sudeste,FALSE,FALSE,-109283877.10
2021,RJ,"COMPANHIA DO METROPOLITANO DO RIO DE JANEIRO - METRÔ ""Em Liquidação""",EM LIQUIDAÇÃO,TRANSPORTE,SOCIEDADE DE ECONOMIA MISTA,Dependente,-506141292.33,-4520622320.95,NÃO,NÃO,NÃO, R$ -   ,Não,0,0.00,36369.46,0.00,48933.04,50350.56,0.00,0.00,,,,Rio de Janeiro,Sudeste,FALSE,FALSE,-48933.04
2021,RJ,CEASA-RJ,ATIVA,ABASTECIMENTO DE ALIMENTOS E OUTROS INSUMOS,SOCIEDADE DE ECONOMIA MISTA,Dependente,34834198.40,-1228656.30,SIM,SIM,NÃO," R$ 10,565,500,000,000,000.00 ",Não,250,4382644.93,22516224.56,0.00,0.00,0.00,0.00,0.00,,,,Rio de Janeiro,Sudeste,FALSE,FALSE,0.00
2021,RJ,Empresa de Obras Públicas do Estado do Rio de Janeiro - EMOP,ATIVA,HABITAÇÃO E URBANIZAÇÃO,EMPRESA PÚBLICA,Dependente,-282961269.66,-256452.45,SIM,SIM,NÃO," R$ 38,022,500,000,000,000.00 ",Não,447,0.00,42630626.93,0.00,0.00,0.00,0.00,0.00,,,,Rio de Janeiro,Sudeste,FALSE,FALSE,0.00
2021,RJ,Companhia de Desenvolvimento Rodoviário e Terminais RJ - CODERTE,ATIVA,TRANSPORTE,SOCIEDADE DE ECONOMIA MISTA,Não Dependente,12873944.83,-3532220.46,SIM,SIM,NÃO," R$ 127,527.70 ",Não,144,0.00,5693843.03,0.00,0.00,0.00,0.00,0.00,,,,Rio de Janeiro,Sudeste,FALSE,FALSE,0.00
2021,RJ,EMPRESA DE PESQUISA AGROPECUARIA DO ESTADO DO RJ - PESAGRO,ATIVA,PESQUISA E ASSISTÊNCIA TÉCNICA AGROPECUÁRIA,EMPRESA PÚBLICA,Dependente,-10927083.36,-3795358.47,SIM,SIM,SIM," R$ 25,222,700,000,000,000.00 ",Não,256,1350250.40,27757575.38,0.00,33908942.35,36642948.93,0.00,0.00,,,,Rio de Janeiro,Sudeste,TRUE,FALSE,-33908942.35
2021,RN,AGÊNCIA DE FOMENTO DO RN SA,ATIVA,FINANCEIRO,SOCIEDADE DE ECONOMIA MISTA,Não Dependente,51441619.58,950759.53,SIM,SIM,NÃO," R$ 78,144,500,000,000,000.00 ",Não,47,143300.00,7744917.99,968470.00,0.00,0.00,0.00,0.00,,http://www.agn.rn.gov.br/Conteudo.asp?TRAN=ITEM&TARG=182444&ACT=&PAGE=0&PARM=&LBL=AGN%2FRN,,Rio Grande do Norte,Nordeste,FALSE,FALSE,968470.00
2021,RN,CENTRAIS DE ABASTECIMENTO DO RIO GRANDE DO NORTE S/A,ATIVA,ABASTECIMENTO DE ALIMENTOS E OUTROS INSUMOS,SOCIEDADE DE ECONOMIA MISTA,Dependente,1438950.00,632794.00,SIM,SIM,NÃO," R$ 93,836,000,000,000,000.00 ",Não,108,2976266.00,8881141.00,0.00,7078128.00,7226207.00,0.00,0.00,,http://adcon.rn.gov.br/ACERVO/ceasa/DOC/DOC000000000244794.PDF,,Rio Grande do Norte,Nordeste,FALSE,FALSE,-7078128.00
2021,RN,COMPANHIA DE PROCESSAMENTO DE DADOS DO RN - DATANORTE,ATIVA,HABITAÇÃO E URBANIZAÇÃO,SOCIEDADE DE ECONOMIA MISTA,Dependente,-71885776.00,-11261948.00,SIM,SIM,NÃO," R$ 17,388,900,000,000,000.00 ",Não,136,377750.04,51726439.00,0.00,2863552.00,2820494.00,0.00,0.00,,,,Rio Grande do Norte,Nordeste,FALSE,FALSE,-2863552.00
2021,RN,COMPANHIA DE AGUAS E ESGOTOS DO RIO GRANDE DO NORTE - CAERN,ATIVA,SANEAMENTO,SOCIEDADE DE ECONOMIA MISTA,Não Dependente,2311851990.30,22297504.42,SIM,SIM,SIM," R$ 47,904,500,000,000,000.00 ",Sim,2128,131697024.90,235430578.50,21406193.26,0.00,0.00,0.00,542674809.46,,https://arquivos-transparencia.caern.com.br/index.php/s/0cccxFdPVqwe7hT,,Rio Grande do Norte,Nordeste,TRUE,FALSE,21406193.26
2021,RN,EMPRESA DE PESQUISA AGROPECUÁRIA DO RIO GRANDE DO NORTE - EMPARN,ATIVA,PESQUISA E ASSISTÊNCIA TÉCNICA AGROPECUÁRIA,EMPRESA PÚBLICA,Dependente,1284954.24,-1999241.48,SIM,SIM,NÃO," R$ 26,366,700,000,000,000.00 ",Não,90,62290.41,14636812.58,0.00,20398700.02,14492049.07,0.00,0.00,,,,Rio Grande do Norte,Nordeste,FALSE,FALSE,-20398700.02
2021,RN,CEHAB - COMPANHIA ESTADUAL DE HABITACAO E DESENVOLVIMENTO URBANO,ATIVA,HABITAÇÃO E URBANIZAÇÃO,SOCIEDADE DE ECONOMIA MISTA,Dependente,14901976.00,1031133.00,SIM,SIM,NÃO," R$ 99,139,700,000,000,000.00 ",Não,28,607463.23,1864117.00,0.00,0.00,0.00,0.00,0.00,,,,Rio Grande do Norte,Nordeste,FALSE,FALSE,0.00
2021,RN,EMPRESA POTIGUAR DE PROMOCAO TURISTICA S/A - EMPROTUR,ATIVA,TURISMO,SOCIEDADE DE ECONOMIA MISTA,Dependente,-2342498.16,-632665.52,SIM,SIM,NÃO," R$ 96,970,800,000,000,000.00 ",Não,37,0.00,3853175.38,0.00,5975514.32,4693958.81,0.00,0.00,,,,Rio Grande do Norte,Nordeste,FALSE,FALSE,-5975514.32
2021,RN,EMPRESA GESTORA DE ATIVOS DO RN - EMGERN,ATIVA,GESTÃO DE ATIVOS,EMPRESA PÚBLICA,Não Dependente,79185.78,0.00,SIM,SIM,NÃO," R$ 16,541,800,000,000,000.00 ",Não,22,0.00,2254009.50,0.00,0.00,0.00,0.00,0.00,,,,Rio Grande do Norte,Nordeste,FALSE,FALSE,0.00
2021,RN,COMPANHIA POTIGUAR DE GÁS,ATIVA,GÁS E DERIVADOS,SOCIEDADE DE ECONOMIA MISTA,Não Dependente,73073281.89,10293586.35,SIM,SIM,SIM," R$ 35,105,400,000,000,000.00 ",Sim,59,5863182.88,12227425.33,1843952.47,0.00,0.00,0.00,0.00,,https://www.potigas.com.br/public/docs/carta-anual-politica-publica-2020.pdf,,Rio Grande do Norte,Nordeste,TRUE,FALSE,1843952.47
2021,RO,SOCIEDADE DE PORTOS E HIDROVIAS DO ESTADO DE RONDÔNIA,ATIVA,PORTOS E HIDROVIAS,EMPRESA PÚBLICA,Não Dependente,1002173.33,-1837826.67,SIM,SIM,NÃO," R$ 317,489.25 ",Não,80,0.00,9185190.21,0.00,0.00,0.00,0.00,0.00,,http://www.rondonia.ro.gov.br/soph/sobre/auditoria-inspecoes-e-prestacoes-de-contas/3-prestacao-de-contas/,,Rondônia,Norte,FALSE,FALSE,0.00
2021,RO,COMPANHIA RONDONIENSE DE GÁS - RONGÁS,ATIVA,GÁS E DERIVADOS,SOCIEDADE DE ECONOMIA MISTA,Não Dependente,1379959.03,-533598.55,SIM,SIM,NÃO," R$ 12,271,000,000,000,000.00 ",Não,1,0.00,426163.04,0.00,0.00,0.00,85000.00,85000.00,,,,Rondônia,Norte,FALSE,FALSE,-85000.00
2021,RO,COMPANHIA DE MINERAÇÃO DE RONDÔNIA,ATIVA,MINERAÇÃO,EMPRESA PÚBLICA,Não Dependente,1844335393.61,634741.94,SIM,SIM,NÃO," R$ 192,000.00 ",Não,20,0.00,2700834.28,0.00,0.00,0.00,0.00,0.00,,https://transparencia.ro.gov.br/?pEncPastaId=abIK_SBgUC6-OpArkckapLFnVvocJ-KpJs4ZPp4BOla7pig9g9PTI73SQUWUqLbkwFgmIQ67vhI-VlyjmfJT-yBTaER-EJUawIVB0Wv06Q03QU4L#!,,Rondônia,Norte,FALSE,FALSE,0.00
2021,RO,BANCO DO ESTADO DE RONDÔNIA S/A,EM LIQUIDAÇÃO,FINANCEIRO,SOCIEDADE DE ECONOMIA MISTA,Não Dependente,0.00,0.00,NÃO,NÃO,NÃO, R$ -   ,Não,0,0.00,0.00,0.00,0.00,0.00,0.00,0.00,,,,Rondônia,Norte,FALSE,FALSE,0.00
2021,RO,COMPANHIA DE DESENVOLVIMENTO URBANO E RURAL DE RONDÔNIA,EM LIQUIDAÇÃO,HABITAÇÃO E URBANIZAÇÃO,SOCIEDADE DE ECONOMIA MISTA,Não Dependente,0.00,0.00,NÃO,NÃO,NÃO, R$ -   ,Não,0,0.00,0.00,0.00,0.00,0.00,0.00,0.00,,,,Rondônia,Norte,FALSE,FALSE,0.00
2021,RO,RONDONIA CREDITO IMOBILIARIO SA.,EM LIQUIDAÇÃO,HABITAÇÃO E URBANIZAÇÃO,SOCIEDADE DE ECONOMIA MISTA,Não Dependente,0.00,0.00,NÃO,NÃO,NÃO, R$ -   ,Não,0,0.00,0.00,0.00,0.00,0.00,0.00,0.00,,,,Rondônia,Norte,FALSE,FALSE,0.00
2021,RO,COMPANHIA DE ÁGUA E ESGOTO DE RONDÔNIA,ATIVA,SANEAMENTO,SOCIEDADE DE ECONOMIA MISTA,Não Dependente,162631833.00,-43130969.00,SIM,SIM,NÃO," R$ 39,138,300,000,000,000.00 ",Não,688,5527597.00,92900346.00,0.00,5326992.00,334078.00,0.00,0.00,,https://transparencia.ro.gov.br/Arquivo/VisualizarArquivo?pEncArquivoId=NgsAOVsVepr8I0plhYaFdE2fqrv2eDKI4DMQvWrQyeGnQDzkVuF-_WaV8GYyFZpvinCKrR3xXJ1zGpotIbSemwJI2VpPMlKNYlfBe3MQRUc3QU4L,,Rondônia,Norte,FALSE,FALSE,-5326992.00
2021,RO,COMPANHIA DE PROCESSAMENTO DE DADOS DO ESTADO DE RO,EM LIQUIDAÇÃO,INFORMÁTICA E TECNOLOGIA DA INFORMAÇÃO,SOCIEDADE DE ECONOMIA MISTA,Não Dependente,0.00,0.00,NÃO,NÃO,NÃO, R$ -   ,Não,0,0.00,0.00,0.00,0.00,0.00,0.00,0.00,,,,Rondônia,Norte,FALSE,FALSE,0.00
2021,RR,Agência de Formento do Estado de Roraima - AFERR,ATIVA,DESENVOLVIMENTO REGIONAL,EMPRESA PÚBLICA,Dependente,6492428.03,-626883.00,SIM,SIM,NÃO," R$ 417,150.00 ",Não,32,15068.94,4411000.00,0.00,4853455.53,5144983.56,0.00,0.00,,,,Roraima,Norte,FALSE,FALSE,-4853455.53
2021,RR,Companhia Energetica de Roraima - CER,ATIVA,ENERGIA,SOCIEDADE DE ECONOMIA MISTA,Dependente,44129294.74,-290332023.30,SIM,SIM,SIM," R$ 254,925.00 ",Não,211,16109.66,35358277.79,0.00,31084715.96,31860362.07,0.00,0.00,,,,Roraima,Norte,TRUE,FALSE,-31084715.96
2021,RR,Companhia de Águas e Esgostos de Roraima - CAER,ATIVA,SANEAMENTO,SOCIEDADE DE ECONOMIA MISTA,Não Dependente,-495840902.55,-102406219.39,SIM,SIM,NÃO," R$ 36,785,600,000,000,000.00 ",Não,795,3283814.00,60044294.54,0.00,0.00,0.00,0.00,0.00,,,,Roraima,Norte,FALSE,FALSE,0.00
2021,RR,Companhia de Desenvolvimento de Roraima - CODESAIMA,ATIVA,ABASTECIMENTO DE ALIMENTOS E OUTROS INSUMOS,SOCIEDADE DE ECONOMIA MISTA,Dependente,114350527.95,-1610355.79,SIM,SIM,NÃO," R$ 301,275.00 ",Não,258,0.00,15618855.98,0.00,17160911.34,18853987.68,0.00,0.00,,,,Roraima,Norte,FALSE,FALSE,-17160911.34
2021,RR,Empresa Radio e Televisao Difusora de Roraima - Radioraima,ATIVA,COMUNICAÇÃO,EMPRESA PÚBLICA,Dependente,-2382504.56,-500533.40,SIM,NÃO,SIM," R$ 97,500.00 ",Não,55,38502.00,4236131.13,0.00,4514009.96,5884312.11,0.00,0.00,,,,Roraima,Norte,FALSE,FALSE,-4514009.96
2021,RS,Caixa de Administração da Dívida Pública Estadual - CADIP,ATIVA,FINANCEIRO,SOCIEDADE DE ECONOMIA MISTA,Não Dependente,221328000.00,-158000.00,SIM,SIM,NÃO, R$ -   ,Não,0,0.00,0.00,0.00,0.00,0.00,0.00,0.00,,http://www.cadip.rs.gov.br/conteudo/1337/2020,,Rio Grande do Sul,Sul,FALSE,FALSE,0.00
2021,RS,BADESUL Desenvolvimento SA - Agência de Fomento/RS,ATIVA,FINANCEIRO,SOCIEDADE DE ECONOMIA MISTA,Não Dependente,743032000.00,13091000.00,SIM,SIM,SIM," R$ 42,358,200,000,000,000.00 ",Sim,120,0.00,32730000.00,0.00,0.00,0.00,0.00,0.00,,https://www.badesul.com.br/transparencia#11,,Rio Grande do Sul,Sul,TRUE,FALSE,0.00
2021,RS,Companhia Estadual de Energia Elétrica Participações - CEEE-PAR,ATIVA,ENERGIA,SOCIEDADE DE ECONOMIA MISTA,Não Dependente,-1082055000.00,-693151000.00,SIM,SIM,SIM,,,,0.00,854269000.00,0.00,0.00,0.00,0.00,0.00,,https://www.ceee.com.br/a-ceee/governanca/compliance,,Rio Grande do Sul,Sul,TRUE,FALSE,0.00
2021,RS,Companhia Estadual de Distribuição de Enegia Eletrica - CEEE-D,ATIVA,ENERGIA,SOCIEDADE DE ECONOMIA MISTA,Não Dependente,-5742894000.00,-1622898000.00,SIM,SIM,SIM," R$ 58,648,900,000,000,000.00 ",Não,2742,0.00,526510000.00,0.00,0.00,0.00,0.00,0.00,,https://www.ceee.com.br/a-ceee/governanca/compliance,,Rio Grande do Sul,Sul,TRUE,FALSE,0.00
2021,RS,Empresa Gaúcha de Rodovias - EGR,ATIVA,TRANSPORTE,EMPRESA PÚBLICA,Não Dependente,0.00,0.00,SIM,SIM,SIM," R$ 232,127.22 ",Não,55,0.00,7799679.62,0.00,0.00,0.00,0.00,0.00,,,,Rio Grande do Sul,Sul,TRUE,FALSE,0.00
2021,RS,Companhia de Gás do Estado RGS - SULGÁS,ATIVA,GÁS E DERIVADOS,SOCIEDADE DE ECONOMIA MISTA,Não Dependente,190142000.00,79442000.00,SIM,SIM,SIM," R$ 37,598,000,000,000,000.00 ",Sim,130,2000.00,35053000.00,21696866.27,0.00,0.00,0.00,0.00,,https://www.sulgas.rs.gov.br/sulgas/transparencia-ativa,,Rio Grande do Sul,Sul,TRUE,FALSE,21696866.27
2021,RS,Companhia de Processamento de Dados do Estado do RS - PROCERGS,ATIVA,INFORMÁTICA E TECNOLOGIA DA INFORMAÇÃO,SOCIEDADE DE ECONOMIA MISTA,Não Dependente,-41519923.56,11673137.32,SIM,SIM,SIM," R$ 434,552.00 ",Sim,1111,0.00,214110956.70,0.00,0.00,0.00,0.00,0.00,,https://www.procergs.rs.gov.br/carta-de-politicas-publicas,,Rio Grande do Sul,Sul,TRUE,FALSE,0.00
2021,RS,Banco do Estado do Rio Grande do Sul - BANRISUL,ATIVA,FINANCEIRO,SOCIEDADE DE ECONOMIA MISTA,Não Dependente,7792367000.00,727476000.00,SIM,SIM,SIM, R$ -   ,Sim,10725,0.00,2128530000.00,106266249.10,0.00,0.00,0.00,0.00,,https://ri.banrisul.com.br/governanca-corporativa/carta-anual-de-governanca-corporativa-2/,,Rio Grande do Sul,Sul,TRUE,FALSE,106266249.14
2021,RS,Companhia Estadual de Geração e Transmissão de Energia Eletrica - CEEE-GT,ATIVA,ENERGIA,SOCIEDADE DE ECONOMIA MISTA,Não Dependente,2537678000.00,278896000.00,SIM,SIM,SIM," R$ 56,385,400,000,000,000.00 ",Não,1322,0.00,312558000.00,0.00,0.00,0.00,0.00,0.00,,https://www.ceee.com.br/a-ceee/governanca/compliance,,Rio Grande do Sul,Sul,TRUE,FALSE,0.00
2021,RS,Companhia Riograndense de Mineração - CRM,ATIVA,ENERGIA,SOCIEDADE DE ECONOMIA MISTA,Não Dependente,300917520.43,-6194502.21,SIM,SIM,SIM," R$ 27,624,400,000,000,000.00 ",Não,289,0.00,24483917.99,0.00,0.00,0.00,0.00,0.00,,https://www.crm.rs.gov.br/documentos-institucionais,,Rio Grande do Sul,Sul,TRUE,FALSE,0.00
2021,RS,Companhia Riograndense de Saneamento - CORSAN,ATIVA,SANEAMENTO,SOCIEDADE DE ECONOMIA MISTA,Não Dependente,4032697000.00,1814394000.00,SIM,SIM,SIM," R$ 56,443,900,000,000,000.00 ",Sim,5688,845000.00,1170058000.00,38000003.00,0.00,0.00,0.00,0.00,,https://www.corsan.com.br/governanca-corporativa,,Rio Grande do Sul,Sul,TRUE,FALSE,38000003.00
2021,RS,CESA,EM LIQUIDAÇÃO,OUTROS,SOCIEDADE DE ECONOMIA MISTA,Não Dependente,0.00,0.00,SIM,SIM,NÃO," R$ 47,461,200,000,000,000.00 ",Não,72,0.00,0.00,0.00,0.00,0.00,0.00,0.00,,,,Rio Grande do Sul,Sul,FALSE,FALSE,0.00
2021,RS,Centrais de Abastecimento do Rio Grande do Sul - CEASA,ATIVA,ABASTECIMENTO DE ALIMENTOS E OUTROS INSUMOS,SOCIEDADE DE ECONOMIA MISTA,Não Dependente,16640926.27,201937.88,SIM,SIM,SIM," R$ 22,993,000,000,000,000.00 ",Não,49,0.00,5942290.21,0.00,0.00,0.00,0.00,0.00,,http://ceasa.rs.gov.br/portal-transparencia/,,Rio Grande do Sul,Sul,TRUE,FALSE,0.00
2021,SC,Imbituba Administradora da Zona de Processamento e de Exportação SA,ATIVA,OUTROS,SOCIEDADE DE ECONOMIA MISTA,Dependente,238440.18,-103576.53,SIM,SIM,NÃO, R$ -   ,Não,0,0.00,50174.62,0.00,0.00,0.00,101909.52,91384.80,,,,Santa Catarina,Sul,FALSE,FALSE,-101909.52
2021,SC,Santa Catarina Participações e Investimentos SA,ATIVA,FINANCEIRO,SOCIEDADE DE ECONOMIA MISTA,Não Dependente,-7977257281.03,-790085056.98,SIM,SIM,SIM, R$ -   ,Não,0,0.00,0.00,0.00,0.00,0.00,0.00,0.00,,,,Santa Catarina,Sul,TRUE,FALSE,0.00
2021,SC,Sapiens Parque SA,ATIVA,HABITAÇÃO E URBANIZAÇÃO,SOCIEDADE DE ECONOMIA MISTA,Dependente,336836419.95,-11140271.18,SIM,SIM,SIM, R$ -   ,Não,0,0.00,1174092.11,0.00,0.00,0.00,24500000.00,0.00,,,,Santa Catarina,Sul,TRUE,FALSE,-24500000.00
2021,SC,SC Participações e Parcerias SA- SCPAR,ATIVA,OUTROS,SOCIEDADE DE ECONOMIA MISTA,Não Dependente,428520646.04,-16192622.43,SIM,SIM,SIM," R$ 24,084,900,000,000,000.00 ",Não,37,3174920.00,8419805.39,0.00,0.00,0.00,6246180.00,0.00,,,,Santa Catarina,Sul,TRUE,FALSE,-6246180.00
2021,SC,Companhia Catarinense de Águas e Saneamento - CASAN,ATIVA,SANEAMENTO,SOCIEDADE DE ECONOMIA MISTA,Não Dependente,1324157433.10,112503999.33,SIM,SIM,SIM," R$ 52,565,300,000,000,000.00 ",Não,2533,375796748.30,375333188.20,0.00,0.00,0.00,0.00,0.00,,,,Santa Catarina,Sul,TRUE,FALSE,0.00
2021,SC,BESC SA Corretora de Seguros e Administração de Bens - BESCOR,ATIVA,OUTROS,SOCIEDADE DE ECONOMIA MISTA,Dependente,-3663283.09,1084489.72,SIM,SIM,NÃO," R$ 29,408,900,000,000,000.00 ",Não,0,0.00,198057.71,0.00,0.00,0.00,235000.00,300000.00,,,,Santa Catarina,Sul,FALSE,FALSE,-235000.00
2021,SC,Agência de Fomento do Estado de Santa Catarina - BADESC,ATIVA,FINANCEIRO,SOCIEDADE DE ECONOMIA MISTA,Não Dependente,609628861.62,12520289.90,SIM,SIM,SIM," R$ 62,291,800,000,000,000.00 ",Não,102,541863.40,38901165.58,5000000.00,0.00,0.00,26000007.00,0.00,,,,Santa Catarina,Sul,TRUE,FALSE,-21000007.00
2021,SC,Companhia de Distritos Industriais de Santa Catarina - CODISC,ATIVA,DESENVOLVIMENTO REGIONAL,SOCIEDADE DE ECONOMIA MISTA,Dependente,1594244.02,207330.87,NÃO,SIM,NÃO," R$ 97,540,400,000,000,000.00 ",Não,0,0.00,118592.33,0.00,0.00,0.00,301353.96,0.00,,,,Santa Catarina,Sul,FALSE,FALSE,-301353.96
2021,SC,Centro de Informática e Automação do Estado de Santa Catarina - CIASC,ATIVA,INFORMÁTICA E TECNOLOGIA DA INFORMAÇÃO,EMPRESA PÚBLICA,Não Dependente,0.00,53737646.94,SIM,SIM,NÃO," R$ 447,556.50 ",Não,343,9276125.73,83463671.29,0.00,0.00,0.00,0.00,0.00,,,,Santa Catarina,Sul,FALSE,FALSE,0.00
2021,SC,Empresa de Pesquisa Agropecuária e Extensão Rural de Santa Catarina - EPAGRI,ATIVA,PESQUISA E ASSISTÊNCIA TÉCNICA AGROPECUÁRIA,EMPRESA PÚBLICA,Dependente,11259678.71,7301552.17,SIM,SIM,SIM," R$ 97,342,200,000,000,000.00 ",Não,1748,3851205.98,326261394.40,372391251.60,0.00,0.00,0.00,0.00,,,,Santa Catarina,Sul,TRUE,FALSE,372391251.60
2021,SC,Companhia de Desenvolvimento Regional do Estado de SC,EM LIQUIDAÇÃO,OUTROS,SOCIEDADE DE ECONOMIA MISTA,Dependente,0.00,5910163.86,NÃO,NÃO,NÃO," R$ 28,942,500,000,000,000.00 ",Não,0,0.00,793702.47,0.00,0.00,0.00,250000.00,6431678.07,,,,Santa Catarina,Sul,FALSE,FALSE,-250000.00
2021,SC,Centrais de Abastecimento de Santa Catarina - CEASA,ATIVA,ABASTECIMENTO DE ALIMENTOS E OUTROS INSUMOS,SOCIEDADE DE ECONOMIA MISTA,Não Dependente,8572059.05,1339699.86,SIM,SIM,NÃO," R$ 13,359,200,000,000,000.00 ",Não,46,198009.06,0.00,0.00,0.00,0.00,0.00,0.00,,,,Santa Catarina,Sul,FALSE,FALSE,0.00
2021,SC,Agência de Desenvolvimento do Turismo de Santa Catarina - SANTUR,EM LIQUIDAÇÃO,TURISMO,SOCIEDADE DE ECONOMIA MISTA,Dependente,292196.69,-93300.05,NÃO,SIM,NÃO," R$ 235,450.00 ",Não,33,0.00,4318750.68,0.00,0.00,0.00,0.00,0.00,,,,Santa Catarina,Sul,FALSE,FALSE,0.00
2021,SC,Companhia Hidromineral Caldas da Imperatriz,ATIVA,TURISMO,EMPRESA PÚBLICA,Não Dependente,1616716.74,-1378878.70,SIM,SIM,NÃO, R$ -   ,Não,68,0.00,512771200.40,0.00,0.00,0.00,0.00,0.00,,,,Santa Catarina,Sul,FALSE,FALSE,0.00
2021,SC,Companhia Integrada de Desenvolvimento Agrícola de Santa Catarina - CIDASC,ATIVA,PESQUISA E ASSISTÊNCIA TÉCNICA AGROPECUÁRIA,EMPRESA PÚBLICA,Dependente,275191188.16,-11030481.62,SIM,SIM,NÃO," R$ 32,813,400,000,000,000.00 ",Não,1268,960936.21,219597386.90,0.00,201023573.80,182152219.20,0.00,0.00,,,,Santa Catarina,Sul,FALSE,FALSE,-201023573.83
2021,SC,Centrais Elétricas de Santa Catarina SA,ATIVA,ENERGIA,SOCIEDADE DE ECONOMIA MISTA,Não Dependente,1984642000.00,518685000.00,SIM,SIM,SIM," R$ 72,199,700,000,000,000.00 ",Sim,3284,671198156.70,778929000.00,13642512.04,0.00,0.00,0.00,0.00,,,,Santa Catarina,Sul,TRUE,FALSE,13642512.04
2021,SC,Companhia de Habitação do Estado de Santa Catarina - COHAB/SC,EM LIQUIDAÇÃO,HABITAÇÃO E URBANIZAÇÃO,SOCIEDADE DE ECONOMIA MISTA,Dependente,-26099206.61,-1981228.32,NÃO,SIM,NÃO," R$ 22,554,300,000,000,000.00 ",Não,20,0.00,5657158.47,0.00,5485403.44,7775814.53,0.00,0.00,,,,Santa Catarina,Sul,FALSE,FALSE,-5485403.44
2021,SC,Banco Regional de Desenvolvimento do Extremo Sul,ATIVA,FINANCEIRO,EMPRESA PÚBLICA,Não Dependente,3099861497.47,199305723.24,SIM,NÃO,SIM," R$ 65,280,300,000,000,000.00 ",Sim,468,8745278.64,189551726.90,0.00,0.00,0.00,0.00,0.00,,,,Santa Catarina,Sul,FALSE,FALSE,0.00
2021,SE,Companhia Estadual de Habitação e Obras Públicas,ATIVA,HABITAÇÃO E URBANIZAÇÃO,SOCIEDADE DE ECONOMIA MISTA,Dependente,111070978.00,3290688.00,SIM,SIM,NÃO," R$ 390,089.00 ",Não,208,0.00,26874206.00,0.00,0.00,0.00,2505031.01,6352788.25,,,,Sergipe,Nordeste,FALSE,FALSE,-2505031.01
2021,SE,Banco do Estado de Sergipe SA,ATIVA,FINANCEIRO,SOCIEDADE DE ECONOMIA MISTA,Não Dependente,487807595.66,54338906.05,SIM,SIM,SIM," R$ 56,055,200,000,000,000.00 ",Sim,965,12640323.00,229942026.50,10246296.73,0.00,0.00,0.00,0.00,,,,Sergipe,Nordeste,TRUE,FALSE,10246296.73
2021,SE,Companhia de Saneamento de Sergipe,ATIVA,SANEAMENTO,SOCIEDADE DE ECONOMIA MISTA,Não Dependente,1638653396.00,7741917.00,SIM,SIM,NÃO," R$ 72,159,500,000,000,000.00 ",Não,1665,155914449.00,257292630.00,0.00,0.00,0.00,132834145.00,115764315.00,,,,Sergipe,Nordeste,FALSE,FALSE,-132834145.00
2021,SE,Empresa Sergipana de Turismo SA,ATIVA,TURISMO,SOCIEDADE DE ECONOMIA MISTA,Dependente,12289159.11,244933.24,SIM,SIM,NÃO," R$ 40,058,000,000,000,000.00 ",Não,49,0.00,3125333.38,0.00,0.00,0.00,0.00,0.00,,,,Sergipe,Nordeste,FALSE,FALSE,0.00
2021,SE,Servicos Graficos de Sergipe,ATIVA,COMUNICAÇÃO,EMPRESA PÚBLICA,Não Dependente,3859060.95,-1163450.30,SIM,SIM,NÃO," R$ 12,567,800,000,000,000.00 ",Não,51,0.00,4006504.35,0.00,0.00,0.00,0.00,0.00,,,,Sergipe,Nordeste,FALSE,FALSE,0.00
2021,SE,Empresa de Desenvolvimento Agropecuário de Sergipe,ATIVA,PESQUISA E ASSISTÊNCIA TÉCNICA AGROPECUÁRIA,EMPRESA PÚBLICA,Dependente,-12234642.36,7566687.52,SIM,SIM,NÃO," R$ 27,360,300,000,000,000.00 ",Não,447,317485.42,52765828.82,0.00,0.00,0.00,0.00,0.00,,,,Sergipe,Nordeste,FALSE,FALSE,0.00
2021,SE,Companhia de Desenvolvimento Economico de Sergipe,ATIVA,DESENVOLVIMENTO REGIONAL,SOCIEDADE DE ECONOMIA MISTA,Dependente,188742444.45,-22890929.37,SIM,SIM,NÃO," R$ 344,477.69 ",Não,118,4738280.15,21416392.74,0.00,0.00,0.00,0.00,0.00,,,,Sergipe,Nordeste,FALSE,FALSE,0.00
2021,SE,Empresa Sergipana de Tecnologia da Informação,ATIVA,INFORMÁTICA E TECNOLOGIA DA INFORMAÇÃO,EMPRESA PÚBLICA,Dependente,6031847.43,2750565.09,SIM,SIM,NÃO," R$ 206,158.66 ",Não,59,0.00,6912809.79,0.00,0.00,0.00,0.00,0.00,,,,Sergipe,Nordeste,FALSE,FALSE,0.00
2021,SE,Companhia Administradora da Zona de Processamento de Exportação de Sergipe,ATIVA,OUTROS,SOCIEDADE DE ECONOMIA MISTA,Dependente,9769.10,135.08,NÃO,NÃO,NÃO, R$ -   ,Não,0,0.00,0.00,0.00,0.00,0.00,0.00,0.00,,,,Sergipe,Nordeste,FALSE,FALSE,0.00
2021,SE,Companhia de Desenvolvimento de Recursos Hídricos e Irrigação de Sergipe,ATIVA,ABASTECIMENTO DE ALIMENTOS E OUTROS INSUMOS,SOCIEDADE DE ECONOMIA MISTA,Dependente,-15662004.69,-7479862.72,SIM,SIM,NÃO," R$ 22,063,500,000,000,000.00 ",Não,295,0.00,44476599.19,0.00,0.00,0.00,0.00,0.00,,,,Sergipe,Nordeste,FALSE,FALSE,0.00
2021,SE,Empresa de Desenvolvimento Sustentavel do Estado de Sergipe,ATIVA,DESENVOLVIMENTO REGIONAL,EMPRESA PÚBLICA,Dependente,-151398.26,709705.55,SIM,SIM,NÃO," R$ 30,635,200,000,000,000.00 ",Não,58,0.00,7689206.31,0.00,0.00,0.00,0.00,0.00,,,,Sergipe,Nordeste,FALSE,FALSE,0.00
2021,SE,Sergipe Gás SA,ATIVA,GÁS E DERIVADOS,SOCIEDADE DE ECONOMIA MISTA,Não Dependente,111473477.08,77643307.89,SIM,SIM,NÃO," R$ 30,744,400,000,000,000.00 ",Sim,71,6857657.26,16443392.00,878564.71,0.00,0.00,0.00,0.00,,,,Sergipe,Nordeste,FALSE,FALSE,878564.71
2021,SP,EMAE-EMPRESA METROPOLITANA DE ÁGUAS E ENERGIA SA,ATIVA,ENERGIA,SOCIEDADE DE ECONOMIA MISTA,Não Dependente,718513485.48,198484795.61,SIM,SIM,SIM," R$ 43,706,800,000,000,000.00 ",Sim,446,37414774.41,110560151.40,24122365.86,0.00,0.00,0.00,0.00,,https://emae.globalri.com.br/pt/carta-de-governanca,,São Paulo,Sudeste,TRUE,FALSE,24122365.86
2021,SP,CPP - COMPANHIA PAULISTA DE PARCERIAS,ATIVA,OUTROS,EMPRESA PÚBLICA,Não Dependente,1842597466.24,72533949.25,SIM,SIM,NÃO," R$ 18,527,100,000,000,000.00 ",Não,5,0.00,3013502.97,23020402.53,0.00,0.00,0.00,0.00,,,,São Paulo,Sudeste,FALSE,FALSE,23020402.53
2021,SP,DOCAS - COMPANHIA DOCAS DE SÃO SEBASTIÃO,ATIVA,PORTOS E HIDROVIAS,EMPRESA PÚBLICA,Dependente,227322193.00,-15386793.00,SIM,SIM,NÃO," R$ 37,077,400,000,000,000.00 ",Não,89,196592.00,11701728.00,0.00,10185232.00,10575519.00,196592.00,2020448.00,,,,São Paulo,Sudeste,FALSE,FALSE,-10381824.00
