2022,PA,EMPRESA DE PROCESSAMNETO DE DADOS,ATIVA,INFORMÁTICA E TECNOLOGIA DA INFORMAÇÃO,EMPRESA PÚBLICA,Dependente,21657505.46,0.00,SIM,SIM,NÃO," R$ 288,821.20 ",Não,328,21657505.46,64746687.10,0.00,81713947.91,57490917.96,0.00,0.00,29081412.99,,NÃO,Pará,Norte,FALSE,FALSE,-81713947.91
2022,PE,AGENCIA DE DESENVOLVIMENTO ECONÔMICO DE PERNAMBUCO S/A - ADEPE,ATIVA,DESENVOLVIMENTO REGIONAL,SOCIEDADE DE ECONOMIA MISTA,Não Dependente,183872800.00,17798389.44,SIM,SIM,NÃO," R$ 152,109.25 ",Não,311,0.00,24761575.07,0.00,0.00,0.00,0.00,0.00,35862477.00,https://www.addiper.pe.gov.br/wp-content/uploads/2022/04/Carta-Anual-de-Pol%c3%adticas-P%c3%bablicas-e-Governan%c3%a7a-Corporativa-2022.pdf,NÃO,Pernambuco,Nordeste,FALSE,FALSE,0.00
2022,PE,AGENCIA DE FOMENTO DO ESTADO DE PERNAMBUCO S.A. - AGE,ATIVA,FINANCEIRO,SOCIEDADE DE ECONOMIA MISTA,Não Dependente,55154542.01,-4070246.74,SIM,SIM,NÃO," R$ 186,533.33 ",Não,69,0.00,5685903.28,0.00,0.00,0.00,6500000.00,6400000.00,78310010.00,http://www.age.pe.gov.br/governancacorporativa,NÃO,Pernambuco,Nordeste,FALSE,FALSE,-6500000.00
2022,PE,COMPANHIA ESTADUAL DE HABITAÇÃO E OBRAS - CEHAB,ATIVA,HABITAÇÃO E URBANIZAÇÃO,SOCIEDADE DE ECONOMIA MISTA,Dependente,29525243.00,-9751725.00,SIM,SIM,NÃO," R$ 101,799.02 ",Não,256,64904245.04,8643548.41,0.00,64291472.35,57119174.90,0.00,0.00,472970.00,http://www.cehab.pe.gov.br/web/cehab/67,NÃO,Pernambuco,Nordeste,FALSE,FALSE,-64291472.35
2022,PE,COMPANHIA EDITORA DE PERNAMBUCO - CEPE,ATIVA,COMUNICAÇÃO,SOCIEDADE DE ECONOMIA MISTA,Não Dependente,54475832.00,-116528.00,SIM,SIM,NÃO," R$ 205,149.70 ",Não,452,276507.44,13423217.00,0.00,0.00,0.00,0.00,0.00,66570000.00,https://www.cepe.com.br/uploads/2022/04/29/626bdc542401a.carta-anual-de-polticas-pblicas-e-governana-corporativa-2021.pdf,NÃO,Pernambuco,Nordeste,FALSE,FALSE,0.00
2022,PE,COMPANHIA PERNAMBUCANA DE SANEAMENTO - COMPESA,ATIVA,SANEAMENTO,SOCIEDADE DE ECONOMIA MISTA,Não Dependente,7145236043.37,246917084.30,SIM,SIM,SIM," R$ 531,631.60 ",Não,6154,632718830.90,516080905.00,30045511.81,0.00,0.00,328395666.13,281033687.31,6491120232.93,https://servicos.compesa.com.br/wp-content/uploads/2022/04/Carta-Anual-de-Politicas-Publicas-e-Governanca-Corporativa_2022.pdf,NÃO,Pernambuco,Nordeste,TRUE,FALSE,-298350154.32
2022,PE,COMPANHIA PERNAMBUCANA DE GÁS - COPERGÁS,ATIVA,GÁS E DERIVADOS,SOCIEDADE DE ECONOMIA MISTA,Não Dependente,410113938.30,194912505.28,SIM,SIM,SIM," R$ 348,339.45 ",Sim,191,57320184.43,35776240.80,59375240.80,0.00,0.00,0.00,0.00,220527578.60,https://www.copergas.com.br/wp-content/uploads/2018/07/Carta-Anual-de-Pol--ticas-P--blicas-e-Governan--a-Corporativa-2022.pdf,NÃO,Pernambuco,Nordeste,TRUE,FALSE,59375240.80
2022,PE,CONSORCIO DE TRANSPORTES DA REGIAO METROPOLITANA DO RECIFE - CTM,ATIVA,TRANSPORTE,EMPRESA PÚBLICA,Dependente,-180552941.00,-9516631.87,NÃO,SIM,NÃO," R$ 310,632.77 ",Não,1204,171666.83,147262769.40,0.00,377998493.10,186430862.30,0.00,0.00,575700.00,https://www.granderecife.pe.gov.br/sitegrctm/wp-content/uploads/2022/05/Carta-Anual.2022.pdf,NÃO,Pernambuco,Nordeste,FALSE,FALSE,-377998493.14
2022,PE,EMPRESA DE TURISMO DE PERNAMBUCO GOVERNADOR EDUARDO CAMPOS - EMPETUR,ATIVA,TURISMO,SOCIEDADE DE ECONOMIA MISTA,Dependente,210174707.13,-6752486.80,SIM,SIM,NÃO," R$ 372,372.00 ",Não,527,73440.95,24495217.07,0.00,62645295.63,82461364.96,0.00,0.00,72065680.99,http://www.setur.pe.gov.br/c/document_library/get_file?p_l_id=44898563&folderId=44901001&name=DLFE-516204.pdf,NÃO,Pernambuco,Nordeste,FALSE,FALSE,-62645295.63
2022,PE,EMPRESA PERNAMBUCO DE COMUNICAÇÃO S/A - EPC,ATIVA,COMUNICAÇÃO,EMPRESA PÚBLICA,Dependente,5635405.00,-797873.94,SIM,SIM,NÃO," R$ 126,908.31 ",Não,83,0.00,2952698.50,0.00,3120616.56,2675380.50,0.00,0.00,3488600.00,https://portalepc.com.br/wp-content/uploads/2022/04/Carta-Anual-de-Pol%C3%ADticas-P%C3%BAblicas-e-Governan%C3%A7a-Corporativa-2021.pdf,NÃO,Pernambuco,Nordeste,FALSE,FALSE,-3120616.56
2022,PE,EMPRESA PERNAMBUCANA DE TRANSPORTE COLETIVO INTERMUNICIPAL - EPTI,ATIVA,TRANSPORTE,EMPRESA PÚBLICA,Dependente,4755171.27,1272052.00,SIM,SIM,NÃO," R$ 106,308.01 ",Não,28,272043.58,2346298.00,0.00,2094362.00,2435520.00,0.00,0.00,0.00,https://www.epti.pe.gov.br/carta-anual-de-politicas-publicas-e-governanca-corporativa/,NÃO,Pernambuco,Nordeste,FALSE,FALSE,-2094362.00
2022,PE,INSTITUTO AGRONÔMICO DE PERNAMBUCO - IPA,ATIVA,PESQUISA E ASSISTÊNCIA TÉCNICA AGROPECUÁRIA,EMPRESA PÚBLICA,Dependente,32165788.00,-2374982.00,SIM,SIM,NÃO," R$ 195,865.93 ",Não,1196,6876378.15,74283525.23,0.00,105281371.00,95257616.53,0.00,0.00,25601618.00,https://site.ipa.br/transparencia/,NÃO,Pernambuco,Nordeste,FALSE,FALSE,-105281370.95
2022,PE,LABORATÓRIO FARMACÊUTICO DO ESTADO DE PE GOV. MIGUEL ARRAES S/A - LAFEPE,ATIVA,SAÚDE,SOCIEDADE DE ECONOMIA MISTA,Não Dependente,204912379.00,40980847.00,SIM,SIM,SIM," R$ 281,766.92 ",Sim,647,7806289.00,41059627.11,15000000.00,0.00,0.00,0.00,0.00,87989242.00,https://www.lafepe.pe.gov.br/wp-content/uploads/2022/04/CARTA-ANUAL-DE-POLITICAS-PUBLICAS-E-GOVERNANCA-CORPORATIVA-EXERCICIO-2021_FINALIZADO.pdf,NÃO,Pernambuco,Nordeste,TRUE,FALSE,15000000.00
2022,PE,PERNAMBUCO PARTICIPAÇÕES E INVESTIMENTOS S.A. - PERPART,ATIVA,GESTÃO DE ATIVOS,SOCIEDADE DE ECONOMIA MISTA,Dependente,-286828822.58,5495691.59,SIM,SIM,NÃO," R$ 193,091.63 ",Não,331,4719.50,71296576.39,0.00,94112676.55,87813815.56,4486929.69,6594960.28,434913326.38,https://www.perpart.pe.gov.br/wp-content/uploads/2022/04/Carta-Anual-de-Politicas-Publicas-e-Governanca-Corporat-iva-Perpart-2022.pdf,NÃO,Pernambuco,Nordeste,FALSE,FALSE,-98599606.24
2022,PE,PORTO DO RECIFE S/A,ATIVA,PORTOS E HIDROVIAS,SOCIEDADE DE ECONOMIA MISTA,Não Dependente,9170819.33,-19855930.66,SIM,SIM,NÃO," R$ 259,544.69 ",Não,193,135757.52,15564145.87,0.00,0.00,0.00,4500000.00,13491300.00,201362946.00,https://www.portodorecife.pe.gov.br/images/galeria/paginas/zljb-2021__carta_anual_de_politicas_publicas_e_governanca_corpotativa.pdf,NÃO,Pernambuco,Nordeste,FALSE,FALSE,-4500000.00
2022,PE,SUAPE - COMPLEXO INDUSTRIAL PORTUARIO GOVERNADOR ERALDO GUEIROS,ATIVA,PORTOS E HIDROVIAS,EMPRESA PÚBLICA,Não Dependente,3240525413.74,64808508.57,SIM,SIM,SIM," R$ 467,032.90 ",Sim,638,71218903.58,68318024.43,0.00,0.00,0.00,2531704.05,2324673.42,1583078289.42,https://www.suape.pe.gov.br/images/institucional/lei-13303/Carta-Anual-de-Politicas-Publicas-_Compromissos_-e-Governanca-Coporativa_1_1.pdf,NÃO,Pernambuco,Nordeste,TRUE,FALSE,-2531704.05
2022,PI,Agência de Fomento e Desenvolvimento do Estado do Piauí S.A - PIAUÍ FOMENTO,ATIVA,FINANCEIRO,SOCIEDADE DE ECONOMIA MISTA,Não Dependente,32083866.31,-1314979.23,SIM,SIM,SIM," R$ 151,150.00 ",Não,20,30155000.00,1342110.70,0.00,0.00,0.00,15803160.00,10002000.00,40807560.00,http://www.fomento.pi.gov.br/cartaanual/,NÃO,Piauí,Nordeste,TRUE,FALSE,-15803160.00
2022,PI,ÁGUAS E ESGOTOS DO PIAUÍ SA,ATIVA,SANEAMENTO,SOCIEDADE DE ECONOMIA MISTA,Não Dependente,-1068937017.25,-143908859.35,SIM,SIM,SIM," R$ 447,473.04 ",Não,1038,15064000.37,238192840.10,0.00,107361110.00,17993666.00,34408805.00,34408805.00,621910776.00,,SIM,Piauí,Nordeste,TRUE,FALSE,-141769915.00
2022,PI,COMPANHIA DE TERMINAIS ALFANDEGADOS DO PIAUI - PORTO-PI,ATIVA,PORTOS E HIDROVIAS,SOCIEDADE DE ECONOMIA MISTA,Dependente,671458.50,-1366464.65,SIM,SIM,SIM," R$ 117,000.00 ",Não,14,0.00,1029653.45,0.00,1500000.00,0.00,0.00,0.00,97500.00,,NÃO,Piauí,Nordeste,TRUE,FALSE,-1500000.00
2022,PI,COMPANHIA METROPOLITANA DE TRANSPORTE PÚBLICO,ATIVA,TRANSPORTE,SOCIEDADE DE ECONOMIA MISTA,Dependente,1697336.84,1330593.53,SIM,SIM,NÃO," R$ 168,400.00 ",Não,71,157560.00,4478895.47,0.00,6825000.00,6108000.00,0.00,0.00,0.00,,NÃO,Piauí,Nordeste,FALSE,FALSE,-6825000.00
2022,PI,EMPRESA DE GESTÃO DE RECURSOS DO ESTADO DO PIAUÍ S/A.,ATIVA,GESTÃO DE ATIVOS,SOCIEDADE DE ECONOMIA MISTA,Dependente,81369595.63,5591278.26,SIM,SIM,NÃO," R$ 445,178.56 ",Não,635,0.00,71465643.26,0.00,105142762.20,95932389.64,0.00,0.00,125885754.92,,NÃO,Piauí,Nordeste,FALSE,FALSE,-105142762.17
2022,PI,COMPANHIA ADMINISTRADORA DA ZONA DE PROCESSAMENTO DE EXPORTAÇÃO DE PARNAÍBA-PI S/A,ATIVA,DESENVOLVIMENTO REGIONAL,SOCIEDADE DE ECONOMIA MISTA,Não Dependente,9714109.39,-4686649.51,SIM,SIM,NÃO," R$ 151,666.67 ",Não,43,9873903.72,2878880.68,0.00,0.00,0.00,4161529.72,3093241.24,20770626.71,,NÃO,Piauí,Nordeste,FALSE,FALSE,-4161529.72
2022,PI,COMPANHIA DE GÁS DO PIAUI - GASPISA,ATIVA,GÁS E DERIVADOS,SOCIEDADE DE ECONOMIA MISTA,Não Dependente,42262.73,-7755.33,SIM,SIM,NÃO," R$ 80,000.00 ",Não,5,13119.90,533137.75,0.00,0.00,0.00,191250.00,191250.00,3124432.00,,NÃO,Piauí,Nordeste,FALSE,FALSE,-191250.00
2022,RN,COMPANHIA DE AGUAS E ESGOTOS DO RIO GRANDE DO NORTE,ATIVA,SANEAMENTO,SOCIEDADE DE ECONOMIA MISTA,Não Dependente,2337242219.83,58032974.94,SIM,SIM,SIM," R$ 480,875.81 ",Sim,2064,131489129.90,262346889.40,11581915.70,0.00,0.00,0.00,0.00,1396762510.40,https://caern.com.br/#/carta-de-servicos,NÃO,Rio Grande do Norte,Nordeste,TRUE,FALSE,11581915.70
2022,RN,CEHAB - COMPANHIA ESTADUAL DE HABITACAO E DESENVOLVIMENTO URBANO,ATIVA,HABITAÇÃO E URBANIZAÇÃO,SOCIEDADE DE ECONOMIA MISTA,Dependente,14901976.00,-2145103.57,SIM,SIM,NÃO," R$ 99,139.69 ",Não,28,1355089.62,1864681.70,0.00,0.00,0.00,0.00,0.00,0.00,,NÃO,Rio Grande do Norte,Nordeste,FALSE,FALSE,0.00
2022,RN,AGENCIA DE FOMENTO DO RIO GRANDE DO NORTE S/A,ATIVA,FINANCEIRO,SOCIEDADE DE ECONOMIA MISTA,Não Dependente,52998071.00,2081948.00,SIM,SIM,NÃO," R$ 63,529.00 ",Não,50,53809.00,8125525.00,0.00,0.00,0.00,0.00,0.00,49142782.00,http://www.adcon.rn.gov.br/ACERVO/agn/DOC/DOC000000000270820.PDF,NÃO,Rio Grande do Norte,Nordeste,FALSE,FALSE,0.00
2022,RN,COMPANHIA POTIGUAR DE GÁS,ATIVA,GÁS E DERIVADOS,SOCIEDADE DE ECONOMIA MISTA,Não Dependente,79947678.65,15857565.39,SIM,SIM,SIM," R$ 389,965.33 ",Sim,62,7769994.02,14998354.72,7873056.97,0.00,0.00,0.00,0.00,57012127.88,,NÃO,Rio Grande do Norte,Nordeste,TRUE,FALSE,7873056.97
2022,RN,Centrais de Abastecimento do Rio Grande do Norte S/A,ATIVA,ABASTECIMENTO DE ALIMENTOS E OUTROS INSUMOS,SOCIEDADE DE ECONOMIA MISTA,Dependente,1691272.00,361239.00,SIM,SIM,NÃO," R$ 175,077.00 ",Não,108,0.00,8068306.00,0.00,7083705.00,7078128.00,0.00,0.00,2165209.00,http://adcon.rn.gov.br/ACERVO/ceasa/DOC/DOC000000000244794.PDF,NÃO,Rio Grande do Norte,Nordeste,FALSE,FALSE,-7083705.00
2022,RN,EMPRESA DE PESQUISA AGROPECUÁRIA DO RN - EMPARN,ATIVA,PESQUISA E ASSISTÊNCIA TÉCNICA AGROPECUÁRIA,EMPRESA PÚBLICA,Dependente,-3629858.05,-646074.94,SIM,SIM,NÃO," R$ 263,666.64 ",Não,89,0.00,15203257.57,0.00,16032418.05,15532094.69,0.00,0.00,863889.00,,NÃO,Rio Grande do Norte,Nordeste,FALSE,FALSE,-16032418.05
2022,RN,Empresa Gestora de Ativos - EMGERN,ATIVA,GESTÃO DE ATIVOS,EMPRESA PÚBLICA,Não Dependente,79059.83,0.00,SIM,SIM,NÃO," R$ 13,376.09 ",Não,24,0.00,1744804.97,0.00,0.00,0.00,0.00,0.00,0.00,http://www.adcon.rn.gov.br/ACERVO/EMGERN/DOC/DOC000000000274950.PDF,NÃO,Rio Grande do Norte,Nordeste,FALSE,FALSE,0.00
2022,RN,COMPANHIA DE PROCESSAMENTO DE DADOS DO RN - DATANORTE,ATIVA,INFORMÁTICA E TECNOLOGIA DA INFORMAÇÃO,SOCIEDADE DE ECONOMIA MISTA,Dependente,224761906.00,-13836878.00,SIM,SIM,NÃO," R$ 178,347.73 ",Não,63,0.00,23757444.00,0.00,2834416.00,2863552.00,0.00,0.00,1954853.00,,NÃO,Rio Grande do Norte,Nordeste,FALSE,FALSE,-2834416.00
2022,RN,EMPRESA POTIGUAR DE PROMOÇÃO TURÍSTICA S.A.,ATIVA,TURISMO,SOCIEDADE DE ECONOMIA MISTA,Dependente,1665563.77,-1082048.62,SIM,SIM,SIM," R$ 100,402.69 ",Não,33,0.00,3661313.79,0.00,11111261.05,5293873.35,0.00,0.00,3800000.00,,NÃO,Rio Grande do Norte,Nordeste,TRUE,FALSE,-11111261.05
2022,RS,Companhia de Processamento de Dados do Estado do RS - PROCERGS,ATIVA,INFORMÁTICA E TECNOLOGIA DA INFORMAÇÃO,SOCIEDADE DE ECONOMIA MISTA,Não Dependente,-13566482.14,28602866.12,SIM,SIM,SIM," R$ 465,482.26 ",Sim,1049,0.00,241354835.70,0.00,0.00,0.00,0.00,0.00,115319287.84,https://www.procergs.rs.gov.br/carta-de-governanca-corporativa,NÃO,Rio Grande do Sul,Sul,TRUE,FALSE,0.00
2022,RS,Caixa de Administração da Dívida Pública Estadual - CADIP,ATIVA,GESTÃO DE ATIVOS,SOCIEDADE DE ECONOMIA MISTA,Não Dependente,210200000.00,-149000.00,SIM,SIM,NÃO, R$ -   ,Não,3,0.00,0.00,0.00,0.00,0.00,0.00,0.00,210200000.00,http://www.cadip.rs.gov.br/lista/631/carta-anual-de-governanca-corporativa,NÃO,Rio Grande do Sul,Sul,FALSE,FALSE,0.00
2022,RS,Companhia Riograndense de Mineração - CRM,ATIVA,MINERAÇÃO,SOCIEDADE DE ECONOMIA MISTA,Não Dependente,286945492.14,-14128463.83,SIM,SIM,SIM," R$ 374,356.18 ",Não,306,0.00,24899421.12,0.00,0.00,0.00,0.00,0.00,289465153.33,https://www.crm.rs.gov.br/documentos-institucionais,NÃO,Rio Grande do Sul,Sul,TRUE,FALSE,0.00
2022,RS,Companhia Riograndense de Saneamento - CORSAN,ATIVA,SANEAMENTO,SOCIEDADE DE ECONOMIA MISTA,Não Dependente,3222315000.00,350469000.00,SIM,SIM,SIM," R$ 679,553.24 ",Sim,5607,791000.00,593963458.30,345205199.70,0.00,0.00,0.00,0.00,1878540000.00,https://www.corsan.com.br/carta-anual,NÃO,Rio Grande do Sul,Sul,TRUE,FALSE,345205199.67
2022,RS,Companhia Estadual de Geração de Energia Elétrica - CEEE-G,ATIVA,ENERGIA,SOCIEDADE DE ECONOMIA MISTA,Não Dependente,916451045.80,209632699.99,SIM,SIM,SIM," R$ 320,543.54 ",Não,237,2581071078.00,42970066.49,0.00,0.00,0.00,0.00,0.00,386975695.47,,NÃO,Rio Grande do Sul,Sul,TRUE,FALSE,0.00
2022,RS,Banco do Estado do Rio Grande do Sul - BANRISUL,ATIVA,FINANCEIRO,SOCIEDADE DE ECONOMIA MISTA,Não Dependente,9046217000.00,948535000.00,SIM,SIM,SIM," R$ 1,368,450.00 ",Sim,10725,2256357000.00,1881441000.00,219526059.40,0.00,0.00,0.00,0.00,5200000000.00,https://ri.banrisul.com.br/governanca-corporativa/carta-anual-de-governanca-corporativa-2/,NÃO,Rio Grande do Sul,Sul,TRUE,FALSE,219526059.36
2022,RS,BADESUL Desenvolvimento S.A. - Agência de Fomento/RS,ATIVA,FINANCEIRO,SOCIEDADE DE ECONOMIA MISTA,Não Dependente,769025000.00,21119000.00,SIM,SIM,SIM," R$ 347,357.75 ",Sim,116,401000.00,32561000.00,0.00,0.00,0.00,0.00,0.00,756343000.00,https://www.badesul.com.br/transparencia,NÃO,Rio Grande do Sul,Sul,TRUE,FALSE,0.00
2022,RS,Companhia de Gás do Estado RGS - SULGÁS,ATIVA,GÁS E DERIVADOS,SOCIEDADE DE ECONOMIA MISTA,Não Dependente,159937000.00,72657000.00,SIM,SIM,SIM, R$ -   ,Não,141,2000.00,24096271.93,28800128.92,0.00,0.00,0.00,0.00,0.00,https://www.sulgas.com.vc/apresentacao,NÃO,Rio Grande do Sul,Sul,TRUE,FALSE,28800128.92
2022,RS,Centrais de Abastecimento do Rio Grande do Sul - CEASA,ATIVA,ABASTECIMENTO DE ALIMENTOS E OUTROS INSUMOS,SOCIEDADE DE ECONOMIA MISTA,Não Dependente,17750319.79,1109393.52,SIM,SIM,SIM," R$ 289,509.45 ",Não,46,23543.15,3569292.15,0.00,0.00,0.00,0.00,0.00,21877617.98,http://ceasa.rs.gov.br/portal-transparencia/,NÃO,Rio Grande do Sul,Sul,TRUE,FALSE,0.00
2022,RS,Empresa Gaúcha de Rodovias - EGR,ATIVA,TRANSPORTE,EMPRESA PÚBLICA,Não Dependente,46604000.00,1300.00,SIM,SIM,SIM," R$ 232,127.22 ",Não,59,0.00,46423926.06,0.00,0.00,0.00,0.00,0.00,43583815.59,,NÃO,Rio Grande do Sul,Sul,TRUE,FALSE,0.00
2022,RS,Companhia Estadual de Silos e Armazéns - CESA,EM LIQUIDAÇÃO,ABASTECIMENTO DE ALIMENTOS E OUTROS INSUMOS,SOCIEDADE DE ECONOMIA MISTA,Não Dependente,-424474713.56,48256301.99,SIM,SIM,NÃO," R$ 461,008.86 ",Não,12,8934.22,13054149.49,0.00,0.00,0.00,0.00,0.00,193337426.29,,NÃO,Rio Grande do Sul,Sul,FALSE,FALSE,0.00
2022,RS,Companhia Estadual de Energia Elétrica Participações - CEEE-Par,ATIVA,ENERGIA,SOCIEDADE DE ECONOMIA MISTA,Não Dependente,826252200.70,907381400.07,SIM,SIM,SIM, R$ -   ,Não,0,1946398413.00,0.00,0.00,0.00,0.00,0.00,0.00,319771069.17,,NÃO,Rio Grande do Sul,Sul,TRUE,FALSE,0.00
2022,RJ,AGÊNCIA DE FOMENTO DO ESTADO DO RJ AS,ATIVA,FINANCEIRO,SOCIEDADE DE ECONOMIA MISTA,Não Dependente,498024615.95,34470053.90,SIM,SIM,SIM," R$ 351,352.43 ",Sim,133,72132.00,30837722.50,0.00,0.00,0.00,0.00,0.00,479504097.72,,NÃO,Rio de Janeiro,Sudeste,TRUE,FALSE,0.00
2022,RJ,Empresa de Assistência Técnica e Extensão Rural do Etado do Rio de Janeiro - EMATER-RIO,ATIVA,PESQUISA E ASSISTÊNCIA TÉCNICA AGROPECUÁRIA,EMPRESA PÚBLICA,Dependente,-233390.14,-314222.25,SIM,SIM,NÃO," R$ 321,598.93 ",Não,589,12300.00,85384631.17,0.00,97325294.49,93666210.78,0.00,0.00,8310646.55,,NÃO,Rio de Janeiro,Sudeste,FALSE,FALSE,-97325294.49
2022,RJ,BANCO DE DESENVOLVIMENTO DO ESTADO DO RJ S/A EM LIQUIDAÇÃO,EM LIQUIDAÇÃO,FINANCEIRO,SOCIEDADE DE ECONOMIA MISTA,Não Dependente,2612834.84,510148.20,NÃO,NÃO,NÃO," R$ 99,139.36 ",Não,2,0.00,334465.03,0.00,0.00,0.00,0.00,0.00,158987017.12,,NÃO,Rio de Janeiro,Sudeste,FALSE,FALSE,0.00
2022,RJ,CENTRAIS ELETRICAS FLUMINENSES S.A. CELF - EM LIQUIDAÇÃO ORDINÁRIA,EM LIQUIDAÇÃO,ENERGIA,SOCIEDADE DE ECONOMIA MISTA,Não Dependente,82.93,0.00,NÃO,NÃO,NÃO, R$ -   ,Não,0,0.00,0.00,0.00,0.00,0.00,0.00,0.00,9225032.81,,NÃO,Rio de Janeiro,Sudeste,FALSE,FALSE,0.00
2022,RJ,DISTRIBUIDORA DE TITULOS E VALORES MOBILIARIOS DO EST. DO RJ S.A - EM LIQUIDAÇÃO ORDINÁRIA,EM LIQUIDAÇÃO,FINANCEIRO,SOCIEDADE DE ECONOMIA MISTA,Não Dependente,681006.68,-1613.41,NÃO,NÃO,NÃO, R$ -   ,Não,0,0.00,0.00,0.00,0.00,0.00,0.00,0.00,11467019.41,,NÃO,Rio de Janeiro,Sudeste,FALSE,FALSE,0.00
2022,RJ,COMPANHIA FLUMINENSE DE TRENS URBANOS - FLUMITRENS E/L,EM LIQUIDAÇÃO,TRANSPORTE,EMPRESA PÚBLICA,Dependente,-1075636476.74,-888816036.97,NÃO,NÃO,NÃO, R$ -   ,Não,5,0.00,410567.34,0.00,2800168.14,2755821.72,0.00,0.00,9430415.98,,NÃO,Rio de Janeiro,Sudeste,FALSE,FALSE,-2800168.14
2022,RJ,COMPANHIA DO METROPOLITANO DO RIO DE JANEIRO - METRÔ E/L,EM LIQUIDAÇÃO,TRANSPORTE,SOCIEDADE DE ECONOMIA MISTA,Dependente,-607732133.25,-4634255177.54,NÃO,NÃO,NÃO, R$ -   ,Não,0,66000.00,0.00,0.00,24690.77,48933.04,0.00,0.00,3808580170.05,,NÃO,Rio de Janeiro,Sudeste,FALSE,FALSE,-24690.77
2022,RJ,INSTITUTO VITAL BRAZIL S/A,ATIVA,SAÚDE,SOCIEDADE DE ECONOMIA MISTA,Dependente,-6756665.00,9582360.00,SIM,SIM,NÃO," R$ 198,403.42 ",Não,403,1703107.89,31854158.86,0.00,76311248.00,4504037.00,0.00,0.00,16024140.67,,NÃO,Rio de Janeiro,Sudeste,FALSE,FALSE,-76311248.00
2022,RJ,COMPANHIA FLUMINENSE DE SECURITIZAÇÃO S.A.- EM LIQUIDAÇÃO ORDINÁRIA,EM LIQUIDAÇÃO,FINANCEIRO,SOCIEDADE DE ECONOMIA MISTA,Não Dependente,-170944.97,-630.00,NÃO,NÃO,NÃO, R$ -   ,Não,0,0.00,0.00,0.00,0.00,0.00,0.00,0.00,4729443.00,,NÃO,Rio de Janeiro,Sudeste,FALSE,FALSE,0.00
2022,RJ,Empresa de Pesquisa Agropecuária do Estado do Rio de Janeiro - Pesagro/RJ,ATIVA,PESQUISA E ASSISTÊNCIA TÉCNICA AGROPECUÁRIA,EMPRESA PÚBLICA,Dependente,-8731546.02,383537.34,SIM,SIM,NÃO," R$ 271,233.11 ",Não,261,129011.30,32222655.45,0.00,0.00,0.00,0.00,0.00,811974.32,,NÃO,Rio de Janeiro,Sudeste,FALSE,FALSE,0.00
2022,RJ,Companhia Estadual de Engenharia de Transportes e Logística - CENTRAL-RJ,ATIVA,TRANSPORTE,EMPRESA PÚBLICA,Dependente,744749415.49,196274507.21,SIM,SIM,SIM," R$ 324,351.07 ",Não,436,0.00,43963926.96,0.00,56393151.66,53782836.22,0.00,0.00,1096356964.24,,NÃO,Rio de Janeiro,Sudeste,TRUE,FALSE,-56393151.66
2022,RJ,COMPANHIA ESTADUAL DE HABITAÇÃO DO RIO DE JANEIRO,ATIVA,HABITAÇÃO E URBANIZAÇÃO,SOCIEDADE DE ECONOMIA MISTA,Dependente,117866046.65,-996141.96,SIM,SIM,NÃO," R$ 237,051.63 ",Não,339,67575513.05,53061451.08,0.00,143449305.60,109283877.10,0.00,0.00,242087910.54,,NÃO,Rio de Janeiro,Sudeste,FALSE,FALSE,-143449305.56
2022,RJ,COMPANHIA ESTADUAL DE ÁGUAS E ESGOTOS DO RIO DE JANEIRO,ATIVA,SANEAMENTO,SOCIEDADE DE ECONOMIA MISTA,Não Dependente,7541103000.00,27136000.00,SIM,SIM,SIM," R$ 1,339,248.00 ",Não,3441,217564000.00,1351848000.00,0.00,0.00,0.00,0.00,0.00,3015828000.00,,NÃO,Rio de Janeiro,Sudeste,TRUE,FALSE,0.00
2022,RJ,IMPRENSA OFICIAL DO ESTADO DO RIO DE JANEIRO,ATIVA,COMUNICAÇÃO,EMPRESA PÚBLICA,Não Dependente,145731648.59,15092067.46,SIM,SIM,NÃO, R$ -   ,Não,299,0.00,22254045.42,0.00,0.00,0.00,0.00,0.00,99385118.92,,NÃO,Rio de Janeiro,Sudeste,FALSE,FALSE,0.00
2022,RJ,Companhia de Armazéns e Silos do Estado do Rio de Janeiro,ATIVA,ABASTECIMENTO DE ALIMENTOS E OUTROS INSUMOS,SOCIEDADE DE ECONOMIA MISTA,Dependente,951453.75,-45047.19,SIM,SIM,NÃO," R$ 174,759.47 ",Não,58,0.00,3048044.48,0.00,4276543.31,3268248.23,0.00,0.00,1520887.26,,NÃO,Rio de Janeiro,Sudeste,FALSE,FALSE,-4276543.31
2022,RJ,CEASA-RJ,ATIVA,ABASTECIMENTO DE ALIMENTOS E OUTROS INSUMOS,SOCIEDADE DE ECONOMIA MISTA,Dependente,38150809.89,-231235.68,SIM,SIM,NÃO," R$ 162,828.30 ",Não,247,1960604.88,17682448.06,0.00,10446448.12,8582395.77,0.00,0.00,33788930.85,,NÃO,Rio de Janeiro,Sudeste,FALSE,FALSE,-10446448.12
2022,RJ,Companhia de Desenvolvimento Industrial do Estado do Rio de Janeiro,ATIVA,DESENVOLVIMENTO REGIONAL,SOCIEDADE DE ECONOMIA MISTA,Dependente,42541238.64,-3970174.75,SIM,SIM,NÃO," R$ 286,378.12 ",Não,97,0.00,868288.47,0.00,11823965.85,9543628.70,0.00,0.00,32114375.34,,NÃO,Rio de Janeiro,Sudeste,FALSE,FALSE,-11823965.85
2022,RJ,COMPANHIA DE TRANSPORTES SOBRE TRILHOS RJ,ATIVA,TRANSPORTE,EMPRESA PÚBLICA,Dependente,397765116.54,-190508341.57,SIM,SIM,SIM," R$ 239,257.06 ",Não,368,0.00,35509186.93,0.00,53216000.00,64523000.00,0.00,0.00,5653397155.36,,NÃO,Rio de Janeiro,Sudeste,TRUE,FALSE,-53216000.00
2022,RJ,Companhia de Turismo do Estado do Rio de Janeiro - TurisRio,ATIVA,TURISMO,EMPRESA PÚBLICA,Dependente,-159157.28,226892.00,SIM,SIM,NÃO," R$ 117,403.66 ",Não,54,0.00,4649901.20,0.00,0.00,0.00,0.00,0.00,8561991.97,,NÃO,Rio de Janeiro,Sudeste,FALSE,FALSE,0.00
2022,RJ,Empresa de Obras Públicas do Estado do Rio de Janeiro,ATIVA,HABITAÇÃO E URBANIZAÇÃO,EMPRESA PÚBLICA,Dependente,-278125443.78,-323475.00,SIM,SIM,NÃO," R$ 410,798.21 ",Não,440,0.00,258204.85,0.00,0.00,0.00,0.00,0.00,2478567.69,,NÃO,Rio de Janeiro,Sudeste,FALSE,FALSE,0.00
2022,RJ,Companhia de Desenvolvimento Rodoviário e Terminais do Estado do Rio de Janeiro,ATIVA,TRANSPORTE,SOCIEDADE DE ECONOMIA MISTA,Dependente,-168834558.10,-182413116.88,SIM,SIM,Não," R$ 159,502.79 ",Não,188,0.00,11059620.40,0.00,0.00,0.00,0.00,0.00,16872235.78,,NÃO,Rio de Janeiro,Sudeste,FALSE,FALSE,0.00
2022,RJ,COMPANHIA DE TRANSPORTES COLETIVOS DO ESTADO DO RIO DE JANEIRO - CTC-RJ,EM LIQUIDAÇÃO,TRANSPORTE,SOCIEDADE DE ECONOMIA MISTA,Dependente,-6176078.96,-76204039.75,NÃO,NÃO,NÃO," R$ 95,955.76 ",Não,4,0.00,408190.70,0.00,480323.11,450438.19,0.00,0.00,70025960.79,,NÃO,Rio de Janeiro,Sudeste,FALSE,FALSE,-480323.11
2022,RO,BANCO DO ESTADO DE RONDONIA S/A,EM LIQUIDAÇÃO,FINANCEIRO,SOCIEDADE DE ECONOMIA MISTA,Não Dependente,0.00,0.00,NÃO,NÃO,NÃO, R$ -   ,Não,0,0.00,0.00,0.00,0.00,0.00,0.00,0.00,0.00,,NÃO,Rondônia,Norte,FALSE,FALSE,0.00
2022,RO,COMPANHIA DE DESENVOLVIMENTO URBANO E RURAL DE RONDONIA,EM LIQUIDAÇÃO,HABITAÇÃO E URBANIZAÇÃO,SOCIEDADE DE ECONOMIA MISTA,Não Dependente,0.00,0.00,NÃO,NÃO,NÃO, R$ -   ,Não,0,0.00,0.00,0.00,0.00,0.00,0.00,0.00,0.00,,NÃO,Rondônia,Norte,FALSE,FALSE,0.00
2022,RO,COMPANHIA DE PROCESSAMENTO DE DADOS DO ESTADO DE RONDONIA,EM LIQUIDAÇÃO,INFORMÁTICA E TECNOLOGIA DA INFORMAÇÃO,SOCIEDADE DE ECONOMIA MISTA,Não Dependente,0.00,0.00,NÃO,NÃO,NÃO, R$ -   ,Não,0,0.00,0.00,0.00,0.00,0.00,0.00,0.00,0.00,,NÃO,Rondônia,Norte,FALSE,FALSE,0.00
2022,RO,RONDONIA CREDITO IMOBILIARIO SA,EM LIQUIDAÇÃO,HABITAÇÃO E URBANIZAÇÃO,SOCIEDADE DE ECONOMIA MISTA,Não Dependente,0.00,0.00,NÃO,NÃO,NÃO, R$ -   ,Não,0,0.00,0.00,0.00,0.00,0.00,0.00,0.00,0.00,,NÃO,Rondônia,Norte,FALSE,FALSE,0.00
2022,RO,COMPANHIA DE MINERAÇÃO DE RONDÔNIA - CMR,ATIVA,MINERAÇÃO,EMPRESA PÚBLICA,Não Dependente,1841848276.03,1351000.24,SIM,SIM,NÃO," R$ 213,333.33 ",Não,22,34067.29,2142718.50,0.00,0.00,0.00,0.00,0.00,25988034.10,,NÃO,Rondônia,Norte,FALSE,FALSE,0.00
2022,RO,SOCIEDADE DE PORTOS E HIDROVIAS DO ESTADO DE RONDONIA,ATIVA,PORTOS E HIDROVIAS,EMPRESA PÚBLICA,Não Dependente,873441.05,-128732.28,SIM,SIM,NÃO," R$ 254,774.52 ",Não,77,0.00,5186468.36,0.00,0.00,0.00,0.00,0.00,2700000.00,,NÃO,Rondônia,Norte,FALSE,FALSE,0.00
2022,RO,COMPANHIA RONDONIENSE DE GÁS - RONGÁS,ATIVA,GÁS E DERIVADOS,SOCIEDADE DE ECONOMIA MISTA,Não Dependente,1882430.48,-9720540.48,SIM,SIM,NÃO," R$ 144,000.00 ",Não,10,0.00,454710.99,0.00,0.00,0.00,170000.00,0.00,7838110.00,,NÃO,Rondônia,Norte,FALSE,FALSE,-170000.00
2022,RO,COMPANHIA DE ÁGUA E ESGOTO DE RONDÔNIA,ATIVA,SANEAMENTO,SOCIEDADE DE ECONOMIA MISTA,Não Dependente,1754444388.00,-73682504.00,SIM,SIM,NÃO," R$ 401,701.00 ",Não,639,15050209.00,98891000.00,0.00,2341937.00,5326992.00,0.00,0.00,162631833.00,https://transparencia.caerd-ro.com.br/governanca,SIM,Rondônia,Norte,FALSE,FALSE,-2341937.00
2022,RR,AGENCIA DE FOMENTO DO ESTADO DE RORAIMA S/A,ATIVA,FINANCEIRO,SOCIEDADE DE ECONOMIA MISTA,Dependente,12263423.24,174721.67,SIM,SIM,NÃO," R$ 23,175.00 ",Não,35,0.00,388333.33,0.00,5390826.89,4853455.53,5259095.11,0.00,5259095.11,,NÃO,Roraima,Norte,FALSE,FALSE,-10649922.00
2022,RR,COMPANHIA DE ÁGUAS E ESGOTOS DE RORAIMA - CAER,ATIVA,SANEAMENTO,SOCIEDADE DE ECONOMIA MISTA,Não Dependente,-615327216.29,-119486313.74,SIM,SIM,NÃO," R$ 278,100.00 ",Não,773,7449523.06,71394258.10,0.00,0.00,0.00,0.00,0.00,47210883.62,,NÃO,Roraima,Norte,FALSE,FALSE,0.00
2022,RR,COMPANHIA ENERGÉTICA DE RORAIMA - CERR,EM LIQUIDAÇÃO,ENERGIA,SOCIEDADE DE ECONOMIA MISTA,Dependente,-45891504.65,-30248948.22,SIM,SIM,SIM," R$ 309,000.00 ",Não,277,0.00,52110633.55,0.00,15099888.09,31084715.96,0.00,0.00,1313101397.05,,NÃO,Roraima,Norte,TRUE,FALSE,-15099888.09
2022,RR,COMPANHIA DE DESENVOLVIMENTO DE RORAIMA - CODESAIMA,ATIVA,ABASTECIMENTO DE ALIMENTOS E OUTROS INSUMOS,SOCIEDADE DE ECONOMIA MISTA,Dependente,85383810.73,-37437458.92,SIM,SIM,NÃO," R$ 280,020.00 ",Não,217,293493.34,16927417.83,0.00,24106938.57,17160911.34,0.00,0.00,533496172.04,,NÃO,Roraima,Norte,FALSE,FALSE,-24106938.57
2022,RR,RÁDIO RORAIMA,ATIVA,COMUNICAÇÃO,EMPRESA PÚBLICA,Dependente,-2260618.02,-158043.54,SIM,NÃO,SIM," R$ 130,000.00 ",Não,55,0.00,3189860.84,0.00,5643493.91,4514009.86,0.00,0.00,800000.00,,NÃO,Roraima,Norte,FALSE,FALSE,-5643493.91
